,author,counts,date,sometext,time,title
83,Вадим Карпусь,   9  , 25.07.2018 в 14:25 ," Разработчики браузера Firefox наконец оснастили его функцией блокирования автоматического воспроизведения аудио на сайтах. Такая возможность появилась в последних сборках Nightly. Добавим, эта…", Обновлено: 25.07.2018 в 14:58 ," В Firefox добавлена функция блокирования автоматического воспроизведения звука, но пока только в тестовых сборках"
84,Владимир Скрипин,   126  , 25.07.2018 в 13:56 ," Как известно, в Sid Meier’s Civilization VI, последней игре знаменитой стратегической серии, на выбор игроку доступны целых 34 цивилизаций (с учетом всех вышедших дополнений). В списке есть даже Грузия, а…", Обновлено: 25.07.2018 в 14:55 ," «Украину – в Civilization!»: Сооснователь Petcube начал кампанию, чтобы достучаться до разработчиков популярной стратегии"
85,Владимир Дяченко,   19  , 25.07.2018 в 13:50 ," С трудом можно представить себе современного человека, дома у которого не найдется ни одного гаджета с поддержкой внешних карт памяти или USB-накопителя. Формат карт памяти microSD получил…", Обновлено: 25.07.2018 в 13:45 , Знакомимся с картой памяти повышенной надёжности Samsung PRO Endurance и высокоскоростным USB флеш-накопителем Bar Plus
86,Сергей Кулеш,   17  , 25.07.2018 в 13:13 ," В воскресенье, 10 июня 2018 года, в 15:12 по киевскому времени одновременно начались 173 поездки и доставки, благодаря которым Uber преодолел рубеж в 10 миллиардов поездок. Эти 173 поездки произошли в 93…", Обновлено: 25.07.2018 в 13:13 ," Uber преодолел отметку в 10 миллиардов поездок, половину из которых совершили за последний год"
87,Вадим Карпусь,   13  , 25.07.2018 в 12:49 ," Исследователи из Массачусетского технологического института создали, вероятно, самых маленьких роботов. Они представляют собой микроскопические электронные схемы размером с обычную…", Обновлено: 25.07.2018 в 12:20 ," В MIT разработали крошечных роботов, сопоставимых по размерам с клеткой человека, которые способны искать заболевания внутри тела"
88,Владимир Скрипин,   6  , 25.07.2018 в 12:11 ," Компания Xiaomi, которая вчера представила новые смартфоны Xiaomi A2 и Mi A2 Lite на «голом» Android, достаточно часто добавляет существующим моделям новые конфигурации, отличающиеся объемами памяти.…", Обновлено: 25.07.2018 в 12:20 ," Смартфон Xiaomi Redmi Note 5 получил в два раза больше памяти, цена осталась прежней"
89,Владимир Скрипин,   47  , 25.07.2018 в 11:29 ," Как известно, Uber приостановила испытания беспилотных автомобилей после того, как в марте один из ее робомобилей насмерть сбил пешехода. И вот сейчас спустя четыре месяца после трагического…", Обновлено: 25.07.2018 в 12:32 ," Uber возобновляет испытания беспилотных автомобилей, но пока в ограниченном режиме с полностью ручным управлением"
90,Игорь Сушон,   233  , 25.07.2018 в 11:06 ," Когда-то продукт компании IBM, а сейчас Lenovo, ноутбуки ThinkPad считаются одними из лучших в своем классе. Они встречаются как в простых офисах, так и в космических программах NASA. Красная точка…", Обновлено: 25.07.2018 в 11:06 , Обзор ноутбука Lenovo ThinkPad T480s
91,Вадим Карпусь,   29  , 25.07.2018 в 10:51 ," Компания Toshiba подготовила к выпуску новую серию твердотельных накопителей XG6. Это будут первые SSD, основанные на 96-слойных 3D чипах флэш-памяти, которые способны хранить по 3 бита данных в…", Обновлено: 25.07.2018 в 10:46 , Toshiba анонсировала первые SSD на базе 96-слойных 3D чипов флэш-памяти
92,Вадим Карпусь,   6  , 25.07.2018 в 10:09 , Онлайн-аукцион eBay расширяет перечень поддерживаемых способов оплаты. Этой осенью пользователи сервиса смогут оплачивать покупки при помощи Apple Pay. Такая возможность будет реализована в…, Обновлено: 25.07.2018 в 10:09 , eBay добавит поддержку Apple Pay в качестве средства совершения платежа
93,Владимир Скрипин,   16  , 25.07.2018 в 09:38 ," На прошлой неделе Sony разослала по каналам СМИ приглашение на пресс-конференцию 30 августа в Берлине (в день открытия выставки IFA 2018), где ожидается анонс новых смартфонов Sony Xperia XZ3 и XZ3 Compact. В тот…", Обновлено: 25.07.2018 в 09:39 , Видеоролик демонстрирует трехмерную модель флагманского смартфона Sony Xperia XZ3
94,Игорь Мозуль,   21  , 25.07.2018 в 09:01 ," Британская компания Kano, которая выпускает обучающие компьютерные комплекты, представила новый набор Harry Potter Kano Coding Kit для обучения детей программированию с помощью волшебной палочки и…", Обновлено: 25.07.2018 в 11:01 , Kano выпустит детский набор для программирования по мотивам Гарри Поттера (волшебная палочка прилагается)
95,Игорь Мозуль,   18  , 25.07.2018 в 08:32 ," Пару месяцев назад мы писали о том, что Google меняет визуальное отображение в адресной строке своего браузера информации о соединении с сайтом с протоколами HTTP и HTTPS. В частности, такие…", Обновлено: 25.07.2018 в 08:03 , Chrome начал помечать незащищенные HTTP-соединения небезопасными
96,Владимир Скрипин,   165  , 25.07.2018 в 08:04 ," Компания Apple признала, что у новых MacBook Pro с мощными шестиядерными процессорами Intel i9 действительно есть проблема с чрезмерным троттлингом – механизмом тепловой защиты процессора с…", Обновлено: 25.07.2018 в 08:36 , Apple признала проблему с чрезмерным троттлингом у новых MacBook Pro и уже решила ее… обновлением ОС
97,Сергей Кулеш,   25  , 24.07.2018 в 20:18 ," К ряду мини-версий ретро-консолей и компьютеров (NES Classic, Mega Drive Mini, Famicom Mini) вскоре присоединится еще одна интересная модель — уже 9 октября фанаты ретро-гейминга смогут приобрести C64 Mini.…", Обновлено: 26.07.2018 в 12:28 ," В октябре в США стартуют продажи ретро-консоли C64 Mini, представляющей собой мини-версию ПК Commodore 64"
98,Сергей Кулеш,   23  , 24.07.2018 в 19:33 ," Криминальная драма «Джокер» с Хоакином Фениксом в главной роли продолжает обрастать подробностями. На прошлой неделе проект получил официальную дату релиза, а сейчас стало известно,…", Обновлено: 25.07.2018 в 10:21 , К фильму «Джокер» с Хоакином Фениксом в главной роли присоединится легендарный экранный гангстер Роберт Де Ниро
99,Сергей Кулеш,   18  , 24.07.2018 в 19:04 ," Недавно мы написали о концепте смартфона Huawei, который скрывает фронтальную камеру в отверстии дисплея. А сегодня в сети появилась информация о патенте Samsung, в котором разработчики предлагают…", Обновлено: 24.07.2018 в 19:01 , Samsung запатентовал смартфон с «загнутым» назад дисплеем и единственной фотокамерой
100,Вадим Карпусь,   41  , 24.07.2018 в 18:51 , Команда сервиса YouTube экспериментирует с новой функцией Explore. Она предназначена для облегчения поиска новых каналов и видео на платформе при просмотре с мобильных устройств. Данная функция…, Обновлено: 24.07.2018 в 19:32 , В мобильном приложении YouTube появится вкладка Explore для персонализированных рекомендаций роликов и каналов
101,Сергей Кулеш,   9  , 24.07.2018 в 18:12 , Компания ADATA Technology представила игровую клавиатуру XPG INFAREX K20 с подсветкой клавиш и механическими переключателями Kailh Blue. Благодаря механическим переключателям Kailh Blue геймеры почувствуют…, Обновлено: 24.07.2018 в 18:12 , ADATA представила геймерскую клавиатуру INFAREX K20 с механическими переключателями Kailh Blue
102,Вадим Карпусь,   102  , 24.07.2018 в 17:49 ," Около недели прошло с тех пор, как на компанию Google в Европе был наложен рекордный штраф в сумме $5 млрд за нарушение антимонопольного законодательства. И вот, Европейская Комиссия оштрафовала…", Обновлено: 24.07.2018 в 17:34 ," Еврокомиссия оштрафовала ASUS, Denon & Marantz, Philips и Pioneer за искусственное завышение цен на их продукцию"
103,Максим Андрейчук,   105  , 24.07.2018 в 17:40 ," Даже если вы десяток лет пользуетесь смартфонами, у вас все равно может возникнуть необходимость обзавестись «звонилкой». Сценарии использования могут быть самыми разными — перечислять не…", Обновлено: 24.07.2018 в 17:39 , Смартфон вместо «звонилки»: обзор Doogee X50 на Android Go
104,Сергей Кулеш,   58  , 24.07.2018 в 17:23 , Украинская телеком-компания lifecell и оператор сети Интернета вещей IoT Ukraine начинают построение первого сегмента Национальной сети Интернета вещей. Запуск в тестовую эксплуатацию сети…, Обновлено: 25.07.2018 в 08:50 , lifecell и IoT Ukraine начали разворачивать первую в Украине Национальную сеть Интернета вещей стандарта LoRaWan
105,Сергей Кулеш,   50  , 24.07.2018 в 17:07 ," Сегодня, 24 июля 2018 года, «королевская битва» Fortnite празднует свой первый день рождения. В честь этого события разработчики подготовили целый ряд уникальных косметических предметов,…", Обновлено: 24.07.2018 в 17:04 ," Fortnite празднует свой первый день рождения с помощью уникальных предметов, тортов, мини-игр и других новинок"
106,Сергей Кулеш,   72  , 24.07.2018 в 16:52 , Крупнейший оператор фиксированной связи Украины «Укртелеком» огласил результаты деятельности за второй квартал текущего года и сообщил о запланированном на осень повышении тарифов.…, Обновлено: 24.07.2018 в 16:34 , «Укртелеком» огласил результаты II квартала 2018 года и запланировал на осень очередное повышение тарифов
107,Владимир Скрипин,   49  , 24.07.2018 в 16:31 ," Холдинг Alphabet, в состав которого входит компания Google, сегодня отчитался за второй квартал 2018 финансового года. Период, который завершился 30 июня, принес холдингу впечатляющие $32,7 млрд дохода.…", Обновлено: 24.07.2018 в 16:31 ," Alphabet впечатляюще нарастил выручку (до $32,7 млрд), но прибыль сильно упала из-за недавнего штрафа Google на $5 млрд"
108,Сергей Кулеш,   15  , 24.07.2018 в 15:50 ," Изданию Thurrott удалось выяснить, что в данный момент Microsoft работает сразу над двумя различными версиями игровой консоли Xbox следующего поколения. Одна из них с кодовым именем «Scarlett» будет…", Обновлено: 24.07.2018 в 16:38 , Microsoft работает сразу над двумя консолями следующего поколения — обновленной Xbox Scarlett и дешевой стриминговой версией для сервиса XCloud
109,Сергей Кулеш,   44  , 24.07.2018 в 15:29 ," Федерация работодателей автомобильной отрасли Украины сообщила, что на основе анализа данных МВД за первое полугодие 2018 года в Украине было зарегистрировано 1788 автомобилей с электрическим…", Обновлено: 24.07.2018 в 15:15 , За первое полугодие 2018 года в Украине зарегистрировали рекордные 1788 электромобилей [инфографика]
110,Владимир Скрипин,   280  , 24.07.2018 в 15:03 ," Сегодня в рамках специального мероприятия в Барселоне компания Xiaomi представила долгожданные смартфоны Mi A2 и Mi A2 Lite, которые будут выпущены в рамках программы Android One и будут официально…", Обновлено: 24.07.2018 в 15:17 ," Смартфоны Xiaomi A2 и Mi A2 Lite представлены официально, цены оказались еще ниже предполагаемых"
111,Владимир Скрипин,   19  , 24.07.2018 в 14:29 ," Google обычно публикует статистику о распространенности всех версий ОС Android исправно – каждый месяц, но иногда случаются выпадения из привычного графика. Свежий отчет вышел вчера, хотя обычно…", Обновлено: 24.07.2018 в 13:57 ," С мая доля Android Oreo увеличилась более чем в два раза — до 12,1%, у Nougat год назад было 11,7%"
112,Сергей Кулеш,   13  , 24.07.2018 в 13:58 ," На выставке CES 2018 компания Samsung впервые продемонстрировала «The Wall» — модульный крупноформатный 146-дюймовый MicroLED-дисплей с 4K-разрешением. Вчера президент компании объявил, что Samsung…", Обновлено: 24.07.2018 в 15:57 ," В следующем году Samsung выпустит более тонкую версию своего MicroLED-дисплея The Wall, которая будет «дешевле, чем ожидается»"
113,Вадим Карпусь,   8  , 24.07.2018 в 13:31 ," Компания Google заявила о заключении партнёрского соглашения со стартапом Digital Asset, который занимается разработкой инструментов для создания приложений на базе блокчейн. Добавим, ранее Google уже…", Обновлено: 24.07.2018 в 13:31 , Google намерена внедрить технологию блокчейн в свои облачные сервисы
114,Владимир Скрипин,   6  , 24.07.2018 в 12:54 ," Более доступная цена – первое, что выделяет нынешние флагманские смартфоны Nokia 8 и Nokia 8 Sirocco на фоне конкурирующих моделей Apple, Samsung, Huawei и LG. Но, похоже, HMD Global, нынешний владелец бренда Nokia,…", Обновлено: 24.07.2018 в 12:41 , Новому флагману Nokia приписывают многомодульную камеру Light и цену в $1000
115,Вадим Карпусь,   167  , 24.07.2018 в 12:19 , Компания Intel постепенно готовится к презентации новых процессоров девятого поколения. Особенностью новой серии будет добавление бренда Core i9 и первых 8-ядерных чипов в массовую настольную…, Обновлено: 25.07.2018 в 09:40 ," Процессоры Intel 9-го поколения получат до 8 ядер, но серия Core i7 лишится поддержки HyperThreading"
116,Максим Андрейчук,   3  , 24.07.2018 в 12:05 ," Meizu 15 можно оценивать по-разному. Смартфон интересен и хорош в первую очередь тем, что отличается от большинства конкурентов дизайном — это и необычный корпус, и соотношение сторон экрана, и…", Обновлено: 24.07.2018 в 12:04 , Видеообзор Meizu 15
117,Владимир Скрипин,   99  , 24.07.2018 в 11:49 ," Сегодня, 24 июля, в Украине заработал еще один сервис бесконтактных платежей. Речь о системе Garmin Pay, которая выделяет устройства этого производителя на фоне моделей конкурентов. Впервые о…", Обновлено: 24.07.2018 в 11:49 , В Украине заработал платежный сервис Garmin Pay
118,Владимир Скрипин,   161  , 24.07.2018 в 11:25 ," Компания Nikon начала рекламную кампанию In Pursuit of Light, посвященную грядущему анонсу первой беззеркальной камеры новой системы. Японский производитель запустил специальный сайт и выложил там…", Обновлено: 24.07.2018 в 11:25 ," Nikon начал дразнить общественность грядущим анонсом беззеркальной камеры системы Nikon Z, опубликовано ее первое фото"
119,Реклама,   18  , 24.07.2018 в 11:15 , Сервис доставки посылок путешественниками TravelPost удивил своих создателей. Предназначенный в первую очередь для перевозок внутри Украины он становится международной почтой. Разработчики…, Обновлено: 24.07.2018 в 11:13 , Доставка посылок попутчиками TravelPost выходит за пределы Украины P
120,Владимир Скрипин,   0  , 24.07.2018 в 10:46 ," В 12:00 по Киеву в Мадриде стартует специальное мероприятие Xiaomi, на котором будут представлены смартфоны Xiaomi Mi A2 и Mi A2 Lite. Презентация будет транслироваться в прямом эфире на канале компании в…", Обновлено: 24.07.2018 в 10:46 ," Gearbest уже принимает предзаказы на смартфоны Xiaomi Mi A2 и Mi A2 Lite, которые представят только после полудня"
121,Игорь Мозуль,   16  , 24.07.2018 в 10:27 ," Boeing столкнулась с проблемами при тестировании космического корабля CST-100 Starliner в прошлом месяце, когда специалисты компании проводили испытания двигателей и системы аварийного спасения. Это…", Обновлено: 24.07.2018 в 10:13 ," Пилотируемый космический корабль Boeing Starliner CST-100, вероятно, задержится на неопределенный срок"
122,Владимир Скрипин,   12  , 24.07.2018 в 09:59 ," Две недели назад Microsoft представила самую доступную в линейке Surface модель планшета под названием Go, предложив покупателям два варианта конфигурации, стоимостью $399 и $549. В первом объем ОЗУ…", Обновлено: 24.07.2018 в 09:59 , В американской рознице замечена еще одна версия планшета Surface Go с 4 ГБ ОЗУ и SSD на 128 ГБ
123,Владимир Скрипин,   23  , 24.07.2018 в 09:17 ," Около месяца назад Xiaomi, которая сейчас выпускает смартфоны под двумя марками — Mi и Redmi – зарегистрировала товарный знак для третьего бренда — POCOPHONE. Заявка была подана в Евросоюзе. То есть,…", Обновлено: 24.07.2018 в 09:17 ," Стало известно, сколько в Европе попросят за смартфон Xiaomi Pocophone с SoC Snapdragon 845"
124,Игорь Мозуль,   9  , 24.07.2018 в 08:37 , Южнокорейская компания Samsung никогда не чуралась странных названий своих продуктов. Взять к примеру музыкальный сервис Milk Music или голосовой помощник Bixby. Но самым странным может стать…, Обновлено: 24.07.2018 в 07:49 ," Умная колонка Samsung, вероятно, будет называться Magbee"
