,author,counts,date,sometext,time,title
42,Владимир Скрипин,   4  , 26.07.2018 в 17:38 ," Шведская компания Spotify, который в апреле вышла на биржу, сегодня опубликовала свой второй финансовый отчет. Для владельца одноименного музыкального стриминг-сервиса 30 июня завершился второй…", Обновлено: 26.07.2018 в 17:38 ," Пользовательская база Spotify превысила 180 млн человек, количество платных подписчиков выросло до 83 млн человек"
43,Вадим Карпусь,   27  , 26.07.2018 в 17:24 ," По словам финансового директора Qualcomm Джорджа Дэвиса, в iPhone нового поколения компания Apple не будет использовать модемы производства Qualcomm, а переключится на продукцию конкурента. Он не уточнил…", Обновлено: 26.07.2018 в 17:24 , Qualcomm: Apple перейдёт на использование модемов конкурента (Intel) для iPhone 2018 года
44,Сергей Кулеш,   24  , 26.07.2018 в 16:39 , Президент телесети HBO Кейси Блойс (Casey Bloys) в общении с журналистами раскрыл несколько подробностей о финальном сезоне сериала Game of Thrones / «Игра престолов» и будущем приквеле по данной…, Обновлено: 26.07.2018 в 16:41 ," HBO: Финальный сезон Game Of Thrones выйдет в первой половине 2019 года, а первый и единственный приквел начнут снимать не раньше следующего года"
45,Владимир Скрипин,   155  , 26.07.2018 в 16:11 ," Вне всякий сомнений, главное «достоинство» операционной системы Windows 10 — это способность обновляться, когда ей вздумается. И хотя еще в прошлом году разработчики добавили опцию отсрочки,…", Обновлено: 26.07.2018 в 16:11 ," Microsoft подключила машинное обучение, чтобы отучить Windows 10 перезагружать ПК, когда ей вздумается"
46,Сергей Кулеш,   62  , 26.07.2018 в 15:48 , Очередь на персонализацию загранпаспортов на полиграфкомбинате «Украина» полностью ликвидирована и документы выдаются в установленные законодательством сроки — в течение 7 или 20…, Обновлено: 26.07.2018 в 15:34 ," ГМС: Очередей на персонализацию биометрических загранпаспортов больше нет, все заказанные документы выдаются вовремя по всей Украине"
47,Вадим Карпусь,   12  , 26.07.2018 в 15:23 ," Во время проведения конференции Next компания Google анонсировала новое решение для обеспечения безопасности – Titan Security Key. На текущий момент оно доступно клиентам облачных сервисов Cloud, но на…", Обновлено: 26.07.2018 в 17:01 , Google анонсировала запуск физических ключей Titan Security Key для обеспечения безопасной авторизации
48,Сергей Кулеш,   33  , 26.07.2018 в 14:59 ," Украинский оператор мобильной связи lifecell подвел финансовые и операционные итоги деятельности за второй квартал 2018 года. Операционный доход lifecell за этот период увеличился на 8,8 % за год, до 1…", Обновлено: 26.07.2018 в 15:06 , lifecell объявил результаты деятельности за второй квартал 2018 года
49,Роман Мельниченко,   104  , 26.07.2018 в 14:30 ," Кроссовер Mitsubishi Eclipse Cross открывает новую страницу для марки в Украине: это самый технологичный и современный автомобиль в гамме Mitsubishi, этакий «маячок» для привлечения внимания клиентов в 2018-м…", Обновлено: 26.07.2018 в 14:30 ," Mitsubishi Eclipse Cross: не откровение, но большой шаг вперед"
50,Владимир Скрипин,   106  , 26.07.2018 в 14:17 ," В прошлом году на конференции Google I/O было объявлено, что в Google Drive насчитывается более 800 млн активных пользователей и более 2 трлн файлов. Сейчас же стало известно, что около 1 млрд людей по…", Обновлено: 26.07.2018 в 17:43 , Google Drive – восьмой продукт компании с более миллиардом активных пользователей
51,Сергей Кулеш,   14  , 26.07.2018 в 13:58 , По данным компании Киевстар ее абоненты продолжают активно использовать мобильную связь в роуминге — во втором квартале 2018 года таких пользователей стало на 63% больше в сравнении со…, Обновлено: 26.07.2018 в 13:27 , Киевстар: За последние два года использование мобильного интернета в роуминге выросло более чем в 15 раз
52,Сергей Кулеш,   44  , 26.07.2018 в 13:34 ," Компания Samsung Display заявила, что созданный ее специалистами «неразбиваемый OLED-экран» (Unbreakable Panel) сертифицирован лабораторией Underwriters Laboratories (UL), которая является официальным тестовым…", Обновлено: 26.07.2018 в 14:12 ," Samsung Display продемонстрировал сертифицированный «неразбиваемый» OLED-экран, который выдерживает удар молотком [видео]"
53,Владимир Скрипин,   6  , 26.07.2018 в 13:06 ," Помимо блокчейн-смартфона HTC Exodus в этом году мы, судя по всему, увидим еще одну модель от этого производителя, подробностями о которой поделился источник. Устройство проходит под кодовым…", Обновлено: 26.07.2018 в 14:12 , Опубликованы характеристики смартфона среднего уровня HTC U12 Life
54,Сергей Кулеш,   17  , 26.07.2018 в 12:45 ," До анонса новых смартфонов iPhone с более производительными процессорами Apple A12 остается чуть больше месяца, а производитель только решился прорекламировать свой предыдущий чип A11 Bionic. По…", Обновлено: 26.07.2018 в 12:24 ," Apple сняла рекламу процессора A11 Bionic, в которой герои игры Vainglory проникают в реальную жизнь [видео]"
55,Владимир Скрипин,   65  , 26.07.2018 в 12:18 ," Сегодня утром мы писали, что инвесторов последний квартальный отчет Facebook не впечатлил (рост выручки оказался недостаточно высоким), в результате чего акции крупнейшей соцсети обвалились…", Обновлено: 26.07.2018 в 14:12 , Марк Цукерберг потерял почти $17 млрд из-за недовольства инвесторов Facebook и рискует выбыть из тройки богатейших людей планеты
56,Владимир Скрипин,   15  , 26.07.2018 в 11:38 ," По предыдущим утечкам нам известно, самая младшая из трех новых моделей смартфонов iPhone, которые представят в сентябре этого года, тоже будет иметь вырез в верхней части экрана. Но именно этот…", Обновлено: 26.07.2018 в 11:38 , Самый доступный из новых смартфонов iPhone может задержаться до октября из-за проблем с производством ЖК-экранов с вырезом
57,Вадим Карпусь,   35  , 26.07.2018 в 11:11 , Компания Google выпустила последнюю предварительную тестовую версию операционной системы Android P — Android P Beta 4 (Developer Preview 5). Она включает окончательные функции и возможности операционной…, Обновлено: 26.07.2018 в 11:11 , Google выпустила последнюю предварительную версию Android P накануне официального релиза ОС
58,Владимир Скрипин,   37  , 26.07.2018 в 10:39 ," Facebook вчера отчиталась за второй квартал 2018 финансового года, который для нее, как и для многих других, завершился 30 июня. Забегая наперед, компания нарастила абсолютно все основные финансовые…", Обновлено: 26.07.2018 в 10:39 ," После публикации отличного квартального отчета акции Facebook резко обвалились более чем на 20%, в результате чего соцсеть потеряла $150 млрд"
59,Игорь Мозуль,   155  , 26.07.2018 в 10:03 ," Управление по санитарному надзору за качеством пищевых продуктов и медикаментов (FDA), наконец, признала искусственное мясо компании Impossible Burger безопасным для употребления в пищу. Ранее…", Обновлено: 26.07.2018 в 09:38 , FDA признало безопасными бургеры Impossible Burger с искусственным мясом
60,Реклама,   0  , 26.07.2018 в 10:00 ," 17 августа Академия интернет-маркетинга WebPromoExperts проведет бесплатную конференцию, посвященную контент-маркетингу, — Content Day. Спикеры мероприятия подготовили 15 докладов на основе реальных…", Обновлено: 25.07.2018 в 17:01 , WebPromoExperts приглашает на международную онлайн-конференцию Content Day P
61,Владимир Скрипин,   137  , 26.07.2018 в 09:34 , С 2015 года SpaceX вернула 27 первых ступеней Falcon 9 после запуска (14 из них были успешно использованы повторно) и теперь ее следующей задачей является отработка технологии возврата головного…, Обновлено: 26.07.2018 в 13:16 ," SpaceX увеличила сеть на судне-пауке в четыре раза, но поймать обтекатель ракеты Falcon 9 опять не удалось"
62,Вадим Карпусь,   26  , 26.07.2018 в 09:02 ," Уже завтра, 27 июля, произойдёт полное лунное затмение. Оно будет обладать целым рядом особенностей. Во-первых, это будет второе и последнее лунное затмение 2018 года. Первое затмение в этом году…", Обновлено: 26.07.2018 в 09:21 , 27 июля произойдёт самое длительное полное лунное затмение XXI века с рядом особенностей
63,Игорь Мозуль,   11  , 26.07.2018 в 08:31 ," Если раньше для проверки текста на грамматические ошибки приходилось использовать сторонние программы и расширения для браузера, например, тот же Grammarly, то теперь такая возможность…", Обновлено: 26.07.2018 в 08:19 , В Google Docs появилась проверка грамматики с использованием технологий машинного обучения
64,Владимир Скрипин,   84  , 26.07.2018 в 08:02 , В конце прошлого года Антимонопольный комитет Украины оштрафовал «Киевстар» примерно на 21 млн грн за вводящую в заблуждение информацию об условиях тарификации. На этой неделе стало…, Обновлено: 26.07.2018 в 10:46 , «Киевстар» не удалось отменить штраф АМКУ на 21 млн за обман абонентов с посекундной тарификацией
65,Сергей Кулеш,   13  , 25.07.2018 в 20:37 ," Фантастический сериал Humans / «Люди» о роботах-синтах, практически неотличимых от людей, переснимут для китайского рынка. На главные роли подписались местные звезды Рэй Ма Тяньюй (Ray Ma Tian-Yu)…", Обновлено: 25.07.2018 в 20:48 ," В Китае снимут собственную версию британского сериала Humans / «Люди» о роботах-андроидах, который в свою очередь является адаптацией шведского сериала"
66,Сергей Кулеш,   3  , 25.07.2018 в 19:51 ," Исполнительный директор Polestar (дочерняя компания Volvo) Джонатан Гудман в интервью изданию Autocar рассказал, чего стоит ждать от второго электромобиля бренда, продажи которого стартуют уже в…", Обновлено: 25.07.2018 в 20:42 ," Электрический седан Polestar 2 получит мощность 400 л.с., запас хода 560 км и ценник от $40 тыс. Он выйдет в 2019 году и будет конкурировать с Tesla Model 3"
67,Вадим Карпусь,   192  , 25.07.2018 в 19:04 ," Группа учёных заявила, что ей удалось обнаружить убедительные доказательства существования на Марсе огромного подземного водоносного горизонта, содержащего воду в жидком состоянии.…", Обновлено: 27.07.2018 в 09:02 ," Учёные обнаружили гигантский подземный резервуар с жидкой водой под поверхностью Марса, где может существовать жизнь"
68,Сергей Кулеш,   10  , 25.07.2018 в 18:36 ," После полутора месяцев бета-тестирования обновленного чата Steam, сервис открыл его для всех пользователей. Напомним, что новая версия чата разрабатывалась с оглядкой на Discord, благодаря чему…", Обновлено: 25.07.2018 в 18:28 , Сегодня Steam открыл обновленный чат для всех пользователей и анонсировал разработку аналогичного приложения для чатов на iPhone и Android
69,Владимир Скрипин,   24  , 25.07.2018 в 18:17 ," После нескольких месяцев разработки Microsoft наконец готова добавить в веб-версию почтовика Outlook.com темную тему оформления, которой разработчики дразнили в начале месяца. Начиная с сегодняшнего…", Обновлено: 25.07.2018 в 18:01 , Microsoft включила темную тему в Outlook.com
70,Сергей Кулеш,   11  , 25.07.2018 в 18:02 , Оператор мобильной связи Vodafone Украина 25 июля запустил 4G в диапазоне 1800 МГц в двух городах Закарпатья: в Ужгороде и Мукачево. АБоненты компании в двух самых крупных городах Закарпатской…, Обновлено: 25.07.2018 в 17:51 , Vodafone запустил 4G в диапазоне 1800 МГц в Ужгороде и Мукачево
71,Вадим Карпусь,   9  , 25.07.2018 в 17:49 ," Грядущие смартфоны Meizu 16 и Meizu 16 Plus засветились в базе данных китайского регулятора TENAA. Однако старший вице-президент компании Ли Нан посетовал, что изображения смартфонов в TENAA оказались не…", Обновлено: 25.07.2018 в 17:46 , Опубликованы официальные рендеры смартфонов Meizu 16 и Meizu 16 Plus — подтверждены вытянутые дисплеи без выреза
72,Владимир Скрипин,   64  , 25.07.2018 в 17:37 ," Что же, результаты независимого тестирования новых MacBook Pro после установки недавнего обновления macOS High Sierra 10.13.6 (17G2208), призванного решить проблему с чрезмерным троттлингом CPU, не заставили…", Обновлено: 25.07.2018 в 17:37 , Apple действительно исправила проблему с чрезмерным троттлингом CPU на новых MacBook Pro. Обновление прошивки оказалось даже эффективнее холодильника
73,Владимир Скрипин,   34  , 25.07.2018 в 17:14 ," Новый видеоролик с трехмерной моделью Xperia XZ3, который мы публиковали сегодня утром, поднял вопрос о том, какой на самом деле будет основная камера грядущего флагмана японского производителя.…", Обновлено: 25.07.2018 в 16:43 , У смартфона Sony Xperia XZ3 будет одинарная основная камера на 48 Мп
74,Сергей Кулеш,   164  , 25.07.2018 в 16:55 ," Национальная комиссия по вопросам регулирования связи и информатизации (НКРСИ) хочет уже в апреле следующего года выдать четырем мобильным операторам — Киевстару, Vodafone Ukraine, lifecell и…", Обновлено: 25.07.2018 в 17:14 ," НКРСИ предложила уже в 2019 году выдать 4G-лицензии на диапазон 800-900 МГц без тендера, путем перераспределения частот Киевстара, Vodafone, lifecell и Интертелекома"
75,Сергей Кулеш,   115  , 25.07.2018 в 16:44 ," В ближайшую пятницу, 27 июля 2018 года, компания Apple совместно с национальной сетью магазинов гаджетов и аксессуаров «Цитрус» открывают первый в Украине Apple Shop. Apple Shop – формат «магазина в…", Обновлено: 25.07.2018 в 17:28 , 27 июля в одесском МегаЦитрусе откроют первый в Украине магазин формата Apple Shop
76,Вадим Карпусь,   41  , 25.07.2018 в 16:31 ," Компания Nikon официально подтвердила циркулировавшие ранее слухи о намерении выпустить беззеркальную полнокадровую (формат Nikon FX) камеру. При этом оказалось, что компания представит сразу…", Обновлено: 25.07.2018 в 16:31 , Nikon официально подтвердила скорый выпуск беззеркальной полнокадровой камеры с новой системой крепления объективов
77,Сергей Кулеш,   56  , 25.07.2018 в 16:14 ," В магазине PlayStation Store стартовала «Летняя распродажа» в рамках которой Sony предлагает скидки на игры для PS4, PS VR, PS3 и PS Vita. В частности, по акционной цене можно купить такие проекты, как Horizon Zero Dawn,…", Обновлено: 25.07.2018 в 16:04 ," В магазине PlayStation Store стартовала «Летняя распродажа» со скидками на игры для PS4, PS VR, PS3 и PS Vita"
78,Максим Андрейчук,   84  , 25.07.2018 в 16:10 ," В борьбе за внимание и лояльность, а также деньги пользователей сражаются все и сразу — семимильными шагами функциональность наращивают что социальные сети, что мессенджеры. Говоря про…", Обновлено: 26.07.2018 в 14:15 , Обзор мессенджера BiP
79,Вадим Карпусь,   67  , 25.07.2018 в 15:59 ," Украинский стартап Pleatpack design совместно с Concepter запустил на Kickstarter кампанию по сбору средств, необходимых для выпуска многофункционального городского рюкзака Pleatpack. Основная идея заключается…", Обновлено: 25.07.2018 в 17:24 ," Украинский стартап успешно вышел на Kickstarter с проектом городского рюкзака Pleatpack, увеличивающегося в объёме на 450%"
80,Владимир Скрипин,   16  , 25.07.2018 в 15:47 ," Компания LG Display отчиталась о результатах своей деятельности за прошедший квартал, который завершился 30 июня 2018. Доход LG Display за отчетный период составил около $5 млрд. Этот результат…", Обновлено: 25.07.2018 в 15:47 , LG Display завершила квартал с убытками в размере $267 млн
81,Владимир Скрипин,   68  , 25.07.2018 в 15:03 , В обозримом будущем в Украине появится государственный портал «Відкритий бюджет для громадян». Министерство финансов Украины подписало договор с государственным учреждением «Відкриті…, Обновлено: 25.07.2018 в 15:02 ," Вскоре Минфин запустит сайт, где можно будет узнать, куда конкретно уходят налоги"
82,Сергей Кулеш,   8  , 25.07.2018 в 14:43 , С сентября 2018 года команда украинских ученых будет работать в кластерном проекте программы «EUREKA» «Future eHealth powered by 5G» — «Будущая электронная сфера здравоохранения на основе технологии 5G».…, Обновлено: 25.07.2018 в 14:58 ," Украинские ученые начинают работу в новом проекте европейской программы «EUREKA», посвященном электронной медицине с использованием 5G-технологий"
