,author,counts,date,sometext,time,title
0,Олег Данилов,   22  , 18.08.2018 в 11:00 , В мае 2018 г. стриминговый сервис Netflix огорошил пользователей трейлером (!) своего первого бумажного (!) комикса The Magic Order от Марка Миллара и Оливье Койпела. На сегодня напечатано уже три из шести…, Обновлено: 17.08.2018 в 15:23 ," The Magic Order / «Магический орден», первый комикс Netflix и Марка Миллара"
1,Олег Данилов,   10  , 18.08.2018 в 09:00 ," Клементина выросла на наших глазах. Мы помним ее маленькой испуганной девочкой в вышедшем 6 лет назад первом сезоне The Walking Dead. Помним, через что ей пришлось пройти в The Walking Dead — Season Two и какую…", Обновлено: 16.08.2018 в 15:49 , The Walking Dead: The Final Season – недетские игры
2,Тарас Мищенко,   68  , 17.08.2018 в 18:07 ," Постепенное исчезновение из смартфонов 3,5 мм разъёма для наушников открывает для производителей новые возможности. Ведь люди, годами не менявшие свои проводные модели, постепенно…", Обновлено: 17.08.2018 в 18:14 , Обзор беспроводных наушников Huawei FreeBuds
3,Вадим Карпусь,   3  , 17.08.2018 в 18:00 , Сервис цифровой дистрибуции Humble Bundle очередной раз предлагает своим пользователям возможность бесплатно получить игру. На этот раз осуществляется раздача ключей для игры Orwell. Orwell — это…, Обновлено: 17.08.2018 в 18:00 , В Humble Bundle бесплатно раздают приключенческий симулятор шпиона Orwell
4,Владимир Скрипин,   41  , 17.08.2018 в 17:50 , Украинский Оскаровский комитет опубликовал список претендентов на выдвижение на премию «Оскар» в номинации «Лучший иностранный фильм». В этом году в национальном отборе поучаствуют шесть…, Обновлено: 17.08.2018 в 17:52 , «Оскар-2019»: названы украинские фильмы-претенденты на премию
5,Реклама,   13  , 17.08.2018 в 17:35 ," Каждый год приносит новые тенденции в эволюции мобильных телефонов. И, на данный момент, самым заметным является наличие флагманских функций. Это можно увидеть на примере серии Huawei Y. Корпус…", Обновлено: 17.08.2018 в 17:32 , Huawei Y6 Prime 2018: бюджетный смартфон с расширенными возможностями P
6,Сергей Кулеш,   43  , 17.08.2018 в 17:21 ," Оператор мобильной связи lifecell сообщил, что ему удалось охватить 4G-сетью в диапазоне 1800 МГц уже 1687 населенных пунктов Украины. Таким образом, доступ к скоростному мобильному интернету…", Обновлено: 17.08.2018 в 17:20 , Доступ к 4G-сети от оператора lifecell получили более 20 миллионов украинцев
7,Владимир Скрипин,   30  , 17.08.2018 в 17:00 ," Несмотря на снижение интереса к добыче криптовалют и, как следствие, падение спроса на видеокарты со стороны добытчиков криптовалюты, продажи у NVIDIA продолжают расти, как грибы после дождя. О…", Обновлено: 17.08.2018 в 17:00 ," NVIDIA нарастила выручку на 40%, а чистую прибыль — на целых 89%"
8,Вадим Карпусь,   9  , 17.08.2018 в 16:37 ," Некоторые компании уже начали работать над новым классом устройств – умными дисплеями (умные динамики, дополненные дисплеями). В их числе оказалась и Google. По данным Nikkei, специалисты…", Обновлено: 17.08.2018 в 16:37 ,Технологии Huawei
9,Вадим Карпусь,   25  , 17.08.2018 в 16:13 ," Компания ASUS подготовила к выпуску новый игровой ноутбук под названием Zephyrus S, который сочетает в себе производительные компоненты и компактные габариты. Анонсированная новинка серии Republic of…", Обновлено: 17.08.2018 в 16:02 ,Huawei и Leica: как тандем компаний делает камеры в смартфонах лучше
10,Владимир Скрипин,   62  , 17.08.2018 в 15:45 ," На этой неделе начались слушания по делу юного 16-летнего хакера из Мельбурна, который в течение года несколько раз проник в компьютерные сети Apple и скачал с серверов компании около 90 гигабайт…", Обновлено: 17.08.2018 в 15:45 ,EMUI — главные особенности интерфейса смартфонов Huawei
11,Владимир Скрипин,   53  , 17.08.2018 в 15:06 ," Запуск Google Pay и Apple Pay показал, что украинские банки не слишком-то торопятся внедрять поддержку мобильных платежных сервисов. Как известно, в конце прошлого месяца в Украине запустился сервис…", Обновлено: 17.08.2018 в 14:56 ,Face Unlock в смартфонах Huawei: как это работает?
12,Сергей Кулеш,   26  , 17.08.2018 в 14:51 ," Киевская независимая геймстудия SignSine представила приключенческую VR-игру PROZE, в которой игроку предстоит исследовать секретный объект «ДУГА» времен холодной войны. Во время работы над…", Обновлено: 17.08.2018 в 14:58 ,«Искусственный интеллект» в смартфонах — как это работает
13,Сергей Кулеш,   15  , 17.08.2018 в 14:27 ," Сеть 4G от Vodafone заработала в Донецкой области, первым городом региона со скоростным интернетом нового поколения в диапазоне 1800 МГц стал Мариуполь. С сегодняшнего дня абоненты оператора в…", Обновлено: 17.08.2018 в 14:27 , Nikkei: Google работает над собственным умным дисплеем
14,Сергей Кулеш,   11  , 17.08.2018 в 14:08 ," В 2014 году Илон Маск впервые упомянул о том, что Tesla работает над автоматической зарядной станцией, которая самостоятельно подключается к электромобилю. Год спустя он выложил короткий…", Обновлено: 17.08.2018 в 13:55 , ASUS анонсировала тонкий игровой ноутбук Zephyrus S и 17-дюймовую модификацию Strix Scar II
15,Тарас Мищенко,   239  , 17.08.2018 в 13:50 ," С 13 августа у нас проходило голосование, в котором читатели могли сравнить фотографии смартфонов Samsung Galaxy S9+, Apple iPhone X, Huawei P20 Pro и Xiaomi Mi 8. Голоса при этом отдавались именно за снимки, так как мы…", Обновлено: 17.08.2018 в 14:08 ," 16-летний австралиец скачал 90 ГБ защищенных данных с серверов Apple. В компании заверяют, что пользователям волноваться не о чем"
16,Сергей Кулеш,   336  , 17.08.2018 в 13:35 ," В комментариях к вчерашней новости о том, что lifecell начинает переводить абонентов предоплаченных тарифов на 28-дневную тарификацию прозвучали справедливые замечания наших читателей о том,…", Обновлено: 17.08.2018 в 14:02 , Еще шесть украинских банков начали поддерживать платежный сервис Garmin Pay
17,Вадим Карпусь,   79  , 17.08.2018 в 13:23 ," Компания Sony  обошла Canon на рынке полнокадровых камер США. При этом Sony стала лидером как по продажам в количественно, так и в денежном выражениях. Отметим, длительное время лидером на этом…", Обновлено: 17.08.2018 в 13:10 ," Киевская геймстудия SignSine разработала VR-игру PROZE в сеттинге S.T.A.L.K.E.R., пролог будет доступен на Steam бесплатно [трейлер]"
18,Владимир Скрипин,   45  , 17.08.2018 в 12:59 ," Как известно, Intel сейчас готовит ответ на недавно представленные высокопроизводительные процессоры AMD Ryzen Threadripper второго поколения. Недавно мы узнали, что новые чипы Intel Core 9000-й серии выйдут 1…", Обновлено: 17.08.2018 в 15:46 , Vodafone Украина запустил 4G в диапазоне 1800 МГц в Мариуполе
19,Сергей Кулеш,   47  , 17.08.2018 в 12:14 ," Несмотря на то, что выпуск первого гибкого смартфона Samsung дело уже решенное, мы пока так и не увидели реалистичных изображений данной модели. В сети преимущественно циркулируют одни и те же…", Обновлено: 17.08.2018 в 12:10 ," Австрийцы создали роботизированную зарядную станцию, которая работает с любыми электромобилями [видео]"
20,Вадим Карпусь,   148  , 17.08.2018 в 11:39 ," Бывший сотрудник команды внутренней безопасности Tesla сообщил Комиссии по ценным бумагам и биржам США, что компания замалчивает информацию о внутренних расследованиях предполагаемой…", Обновлено: 17.08.2018 в 16:05 ," Результаты голосования: сравнение камер Samsung Galaxy S9+, Apple iPhone X, Huawei P20 Pro и Xiaomi Mi 8"
21,Владимир Скрипин,   48  , 17.08.2018 в 11:20 ," В городе Фейетвилл, штат Арканзас, завершились съемки третьего сезона «Настоящего детектива», долгожданного продолжения криминальной антологии американского телеканала HBO. Об этом сообщил…", Обновлено: 17.08.2018 в 12:08 ,Android 9 Pie
22,Игорь Мозуль,   1  , 17.08.2018 в 10:59 ," Многие пользователи предпочитают тёмную тему в мобильных приложениях, и, стоит признать, большинство разработчиков идут им на встречу. Но только не Google. Поисковый гигант не спешит добавлять…", Обновлено: 17.08.2018 в 11:13 ,Состоялся официальный релиз Android 9 Pie
23,Владимир Скрипин,   29  , 17.08.2018 в 10:19 ," Хотя в последнее время в центре внимания находится Fortnite Battle Royale, которую многие считают главной видеоигрой 2018 года, другая популярная королевская битва — PlayerUnknown’s Battlegrounds (PUBG) — тоже не…", Обновлено: 17.08.2018 в 10:19 ,Android P: 10 главных нововведений
24,Сергей Кулеш,   25  , 17.08.2018 в 10:00 , После тизера с датой премьеры второго сезона Iron Fist / «Железный кулак» сервис Netflix опубликовал полноценный трейлер сериала. Во втором сезоне Дэнни Рэнд получает равноценного по силам…, Обновлено: 17.08.2018 в 10:00 , Netflix выложил полноценный трейлер второго сезона сериала Iron Fist / «Железный кулак» от Marvel
25,Владимир Скрипин,   39  , 17.08.2018 в 09:10 ," Фото: Robert Wang / ChinaFotoPress / Camera Press / Vida Press В прошлом месяце мы узнали о секретном проекте Google Dragonfly, в рамках которого создается специальная версия поисковика с цензурой для Китая. Теперь же стало…", Обновлено: 17.08.2018 в 09:10 ," Сотрудники Google воспротивились разработке поисковика с цензурой для Китая. Но Брин и Пичаи, похоже, уже все уладили"
26,Игорь Мозуль,   59  , 17.08.2018 в 08:02 ," Google вносит изменения в процесс отбора приложений для улучшения качества контента на платформе Wear OS. Кроме того, компания также работает над созданием сервиса фитнес-ассистента под названием…", Обновлено: 17.08.2018 в 07:54 , Google вводит новые правила публикации приложений для Wear OS и готовит фитнес-ассистента Google Coach для умных часов Pixel Watch
27,Сергей Кулеш,   48  , 16.08.2018 в 20:10 ," Компания Blizzard Entertainment официально объявила, что легендарная игра Diablo III выйдет на консоли Nintendo Switch до конца текущего года. Специальное издание Diablo III Eternal Collection содержит материалы из всех…", Обновлено: 16.08.2018 в 20:18 , Blizzard официально объявил о выходе Diablo III Eternal Collection на консоли Nintendo Switch
28,Вадим Карпусь,   36  , 16.08.2018 в 19:57 ," Компания Sony заявила, что по состоянию на конец июля она смогла продать 3 млн гарнитур виртуальной реальности PlayStation VR. Следует отметить, что рубеж в 2 млн устройств был преодолён в конце 2017…", Обновлено: 16.08.2018 в 20:11 , Sony продала 3 млн гарнитур PlayStation VR и почти 22 млн копий VR игр и контента
29,Сергей Кулеш,   190  , 16.08.2018 в 19:35 ," Оператор мобильной связи «Vodafone Украина» провел очередное исследование, в котором выяснил, где живут самые активные пользователи мобильного интернета, какие онлайн-сервисы они…", Обновлено: 16.08.2018 в 19:34 ," Vodafone выяснил, как ведут себя «цифровые украинцы» в интернете [инфографика]"
30,Сергей Кулеш,   51  , 16.08.2018 в 19:02 ," На днях фильм Avengers: Infinity War / «Мстители: Война бесконечности» наконец появился в прокате в официальных онлайн-сервисах, что позволило посмотреть его тем, кто не успел в свое время посетить…", Обновлено: 16.08.2018 в 19:09 , Как создавались спецэффекты для фильма Avengers: Infinity War / «Мстители: Война бесконечности» [видео]
31,Вадим Карпусь,   77  , 16.08.2018 в 18:44 ," Пока что ноутбуки на базе чипов ARM представляют собой редкое явление. Но уже через год-два ситуация может измениться. В компании ожидают, что будущие архитектуры обеспечат такой прирост…", Обновлено: 16.08.2018 в 19:59 , ARM: наши следующие процессорные архитектуры превзойдут в плане производительности мобильные чипы Intel
32,Сергей Кулеш,   20  , 16.08.2018 в 18:16 ," Компания Samsung Electronics представила два новых саундбара премиум-класса HW-N950 и HW-N850, созданных в сотрудничестве с известным производителем потребительской аудиотехники Harman Kardon. Отметим, что…", Обновлено: 16.08.2018 в 18:06 , Samsung и Harman Kardon представили новую линейку саундбаров HW-N950 и HW-N850 с поддержкой технологий Dolby Atmos и DTS:X
33,Вадим Карпусь,   82  , 16.08.2018 в 17:59 ," Пока что платформа Linux не может похвастаться обилием игр. Лишь небольшое количество проектов в Steam может похвастаться поддержкой этой платформы. Дело в том, что для портирования игры…", Обновлено: 16.08.2018 в 18:25 ," Valve работает над инструментом, который позволит запускать игры для Windows в… Linux"
34,Владимир Скрипин,   111  , 16.08.2018 в 17:41 ," Как известно, Apple не раз обвинялась в уклонении от уплаты налогов тем или иным способом. И сейчас, похоже, купертиновский гигант рискует оказаться в центре очередного налогового скандала.…", Обновлено: 16.08.2018 в 17:50 ," «$200, а не $1 млрд»: Apple доказывает, что налоговики неверно оценили стоимость зданий штаб-квартиры Apple Park"
35,Сергей Кулеш,   424  , 16.08.2018 в 17:23 ," В первом полугодии 2018 года украинцы искали на онлайн-сервисах разнообразные товары, однако нас больше заинтересовала разница в поисковых запросах между владельцами смартфонов на основе…", Обновлено: 17.08.2018 в 14:08 ," OLX: Владельцы Android чаще всего ищут велосипед, а пользователи iPhone — другой iPhone"
36,Сергей Кулеш,   73  , 16.08.2018 в 16:59 , Сегодня в Киеве прошло первое заседание Координационного совета по вопросам реализации Национальной стратегии управления отходами в Украине до 2030 года. В рамках мероприятия министр…, Обновлено: 16.08.2018 в 16:41 , Минэкологии: К 2030 году в Украине должны перерабатываться или повторно использоваться не менее 70% отходов
37,Сергей Кулеш,   24  , 16.08.2018 в 16:41 ," Компания NOMI объявила о старте продаж нового модельного ряда планшетов в составе устройств Nomi Corsa4, Nomi Libra4 и Nomi Ultra4. Среди новинок — самый доступный в Украине планшет с LTE и Android 8.1. Внешне…", Обновлено: 16.08.2018 в 16:39 ," В Украине стартовали продажи нового поколения планшетов NOMI, в числе которых самая доступная модель с LTE и Android 8.1"
38,Владимир Скрипин,   6  , 16.08.2018 в 16:22 ," На этой неделе наконец созрел плод многолетнего сотрудничества Microsoft и Amazon. Речь о возможности, позволяющей виртуальным ассистентам технологических гигантов – Cortana и Alexa – работать в паре.…", Обновлено: 16.08.2018 в 16:22 , Microsoft и Amazon наконец подружили своих виртуальных помощников
39,Вадим Карпусь,   17  , 16.08.2018 в 16:01 , Компания Intel уже давно работает над созданием собственной дискретной видеокарты и даже переманила из AMD нескольких ключевых сотрудников в этой сфере. Наконец Intel решила привлечь внимание…, Обновлено: 16.08.2018 в 16:01 , Intel готовится выпустить свои дискретные GPU в 2020 году и показала тизерный ролик с видеокартой
40,Вадим Карпусь,   15  , 16.08.2018 в 15:32 ," По данным отчёта TrendForce, на рынке ноутбуков наблюдается рост, который превзошёл ожидания аналитиков. По итогам второго квартала 2018 года совокупный объём поставок ноутбуков по всему миру 41,08…", Обновлено: 16.08.2018 в 15:10 ," TrendForce: Глобальные поставки ноутбуков за год выросли на 2,8%"
41,Виталий Матвиенко,   56  , 16.08.2018 в 15:10 ," Линейка ThinkPad держится особняком не только среди моделей Lenovo, но и вообще среди всех ноутбуков на рынке — мало кто так хранит традиции дизайна и исполнения. Но перемены все же случаются и…", Обновлено: 16.08.2018 в 15:09 , Обзор Lenovo ThinkPad X280
42,Сергей Кулеш,   12  , 16.08.2018 в 14:59 ," Компания Epic Games запустила новую обучающую платформу Unreal Engine Online Learning, которая позволит всем желающим изучить особенности игрового движка Unreal Engine. Полученные в результате изучения…", Обновлено: 16.08.2018 в 14:39 , Epic Games представила новую онлайн-платформу Unreal Engine Online Learning для бесплатного обучения Unreal Engine
43,Владимир Скрипин,   122  , 16.08.2018 в 14:31 , Запись телефонных разговоров на смартфоне – это весьма деликатный вопрос с точки зрения соответствия законодательству и соблюдения конфиденциальности. Именно поэтому (во избежание лишних…, Обновлено: 16.08.2018 в 14:39 , В Android 9.0 Pie компания Google полностью отключила возможность записывать телефонные разговоры
