,author,counts,date,sometext,time,title
171,Владимир Скрипин,   14  , 09.08.2018 в 11:34 ," Как и в случае многих других смартфонов, приближение анонса Huawei Mate 20 Pro сопровождается не только потоком утечек, но соответствующей официальной рекламной кампанией, призванной подогреть…", Обновлено: 09.08.2018 в 11:34 , Рекламное изображение смартфона Huawei Mate 20 Pro указывает на аккумулятор самой большой емкости
172,Вадим Карпусь,   109  , 09.08.2018 в 11:08 ," Министр экологии и природных ресурсов Остап Семерак убежден, что Украина должна активно развиваться в направлении энергосбережения и увеличивать долю возобновляемых источников…", Обновлено: 09.08.2018 в 11:08 ," К 2035 году Украина увеличит долю возобновляемой энергетики до 11%, а в Виннице строится второй завод по выпуску солнечных панелей"
173,Сергей Светличный,   88  , 09.08.2018 в 11:00 , Компания LG продолжает совершенствовать линейку OLED-телевизоров класса премиум – LG Signature. В прошлом году к нам на обзор попала 65-дюймовая модель LG OLED TV G7; флагманом же в модельном ряду 2018 года…, Обновлено: 09.08.2018 в 10:57 , Обзор телевизора LG OLED65W8PLA
174,Владимир Скрипин,   263  , 09.08.2018 в 10:32 ," На днях в украинском сегменте интернета случилось достаточно незаурядное событие – кто-то создал онлайн-инструмент, позволяющий быстро вычислять украинских программистов по IP домашнему…", Обновлено: 09.08.2018 в 13:27 ," Обновлено: Создан сайт, позволяющий быстро узнать адрес прописки и другие персональные данные украинских IT-специалистов, оформленных как ФЛП"
175,Игорь Мозуль,   19  , 09.08.2018 в 09:54 ," Южнокорейская группа компаний Samsung Group объявила о планах инвестировать 25 трлн вон ($22 млрд) в развитие искусственного интеллекта, биофармацевтики, 5G и других современных технологий, которые…", Обновлено: 09.08.2018 в 09:28 ," Samsung выделяет $22 млрд на ИИ, 5G и другие перспективные технологии"
176,Владимир Скрипин,   101  , 09.08.2018 в 09:06 ," На этой неделе Национальная комиссия, осуществляющая государственное регулирование в сфере связи и информатизации (НКРСИ) приняла решение, которым окончательно утвердила дату запуска…", Обновлено: 09.08.2018 в 10:33 , НКРСИ окончательно утвердила дату запуска услуги переноса номера (MNP) и направила проект в правительство
177,Владимир Скрипин,   84  , 09.08.2018 в 08:24 ," Планшеты Amazon всегда стояли в некотором роде особняком и выделялись на общем фоне. Во-первых, они тесно интегрированы с различными сервисами Amazon. Во-вторых, они предлагают хорошее соотношение…", Обновлено: 09.08.2018 в 11:08 , Планшет Amazon Fire HD 8 временно подешевел до $60
178,Игорь Мозуль,   37  , 09.08.2018 в 08:02 ," На протяжении последних нескольких лет мы периодически рассказывали вам о потенциально революционных очках дополненной реальности Magic Leap. И вот вчера эти самые очки, а точнее версия для…", Обновлено: 09.08.2018 в 07:33 , Очки дополненной реальности Magic Leap One Creator Edition поступили в продажу в США по цене $2295. На их разработку ушло 6 лет и $2 млрд
179,Тарас Мищенко,   248  , 08.08.2018 в 20:28 ," Компания Xiaomi совместно с магазином «Алло» объявили о скором старте продаж в Украине смартфонов Mi 8, Mi A2 и Mi A2 Lite. Из всех новинок позже всего в нашу страну приедет флагман компании — Xiaomi Mi 8,…", Обновлено: 08.08.2018 в 20:28 ," Xiaomi объявила в Украине официальные цены на модели Mi 8, Mi A2 и Mi A2 Lite"
180,Вадим Карпусь,   37  , 08.08.2018 в 19:04 ," Как и ожидалось, одновременно со смартфонами Meizu 16 и Meizu 16 Plus была представлена «парящая» колонка Meizu Gravity Speaker. Впервые она засветилась на краудфандинговой платформе Indiegogo ещё в мае 2016 года с…", Обновлено: 10.08.2018 в 09:47 , «Парящая» беспроводная колонка Meizu Gravity Speaker наконец поступила в продажу по цене $146
181,Вадим Карпусь,   45  , 08.08.2018 в 18:33 ," Компания PUBG Corporation заявила о запуске инициативы Fix PUBG (Исправить PUBG), целью которой является всесторонне улучшение игры. «Fix the Game.» This is a phrase we’ve been hearing a lot lately. So today, we’re announcing a new campaign entirely…", Обновлено: 08.08.2018 в 17:59 , Разработчики PUBG запустили кампанию Fix PUBG с целью улучшить игру
182,Вадим Карпусь,   21  , 08.08.2018 в 18:09 ," Компания Qualcomm анонсировала выпуск нового процессора Snapdragon 670, предназначенного для использования в составе устройств среднего уровня. Новинка во многом похожа на недавно представленную…", Обновлено: 08.08.2018 в 18:09 , Qualcomm анонсировала мобильный процессор Snapdragon 670 – менее производительную версию Snapdragon 710
183,Владимир Скрипин,   85  , 08.08.2018 в 17:31 ," До анонса Google Pixel 3 еще целых два месяца, но благодаря плотному потоку утечек мы уже сейчас знаем о смартфоне достаточно много. И если так будет продолжаться, то к моменту анонса не остается…", Обновлено: 08.08.2018 в 18:05 , Google Pixel 3 XL: фото и видео с распаковкой предсерийного экземпляра смартфона
184,Вадим Карпусь,   283  , 08.08.2018 в 17:11 ," В прошлом месяце Министр инфраструктуры Украины Владимир Омелян заявил, что 28 сентября будет запущен поезд «четырёх столиц», который свяжет Киев и Ригу, а кроме того, будет проходить через…", Обновлено: 08.08.2018 в 17:11 , Поездка на поезде «четырёх столиц» из Киева в Ригу займёт 19 часов и будет стоить 1855 грн
185,Владимир Скрипин,   73  , 08.08.2018 в 17:00 ," Стараясь подстегнуть продажи своих видеокарт, а заодно немного отвлечь внимание от грядущего анонса новой флагманской видеокарты NVIDIA GeForce GTX 1180, компания AMD объявила о старте новой…", Обновлено: 08.08.2018 в 18:32 , Raise the Game: AMD дарит покупателям видеокарт серии Radeon RX и готовых систем с ними комплект из трех еще не вышедших игр
186,Владимир Скрипин,   26  , 08.08.2018 в 16:30 ," Несколько часов назад были представлены новые флагманские смартфоны Meizu 16 и 16 Plus, которые получились достаточно интересными устройствами – у них привлекательный дизайн, да и соотношение…", Обновлено: 08.08.2018 в 16:30 , С анонсом смартфонов Meizu 16 модели Meizu 15 значительно подешевели
187,Вадим Карпусь,   22  , 08.08.2018 в 16:16 , У армии США появился новый план по борьбе с неприятельскими дронами. Для их уничтожения предлагается использовать высокомощные авиационные микроволновые пушки. Их планируется закупить у…, Обновлено: 08.08.2018 в 16:48 , Армия США закупит микроволновые пушки для борьбы с БПЛА
188,Вадим Карпусь,   51  , 08.08.2018 в 15:43 , Компания Tesla реализовала новую функцию в своих бытовых аккумуляторных батареях PowerWall. Она позволит сохранять энергоснабжение дома даже в условиях наступления стихийного бедствия. Новая…, Обновлено: 08.08.2018 в 16:48 , Домашние батареи Tesla Powerwall получили специальный режим накопления энергии в случае приближения шторма
189,Владимир Скрипин,   166  , 08.08.2018 в 15:26 ," Сегодня на специальном мероприятии в Пекине компания Meizu официально представила новые смартфоны Meizu 16 и Meizu 16 Plus (некоторые ресурсы называют старшую модель 16 Pro). Не секрет, что аппараты этого…", Обновлено: 08.08.2018 в 17:07 ," Представлены смартфоны Meizu 16 и Meizu 16 Plus: привлекательный дизайн, SoC Snapdragon 845 и цена от $395"
190,Виталий Богданов,   66  , 08.08.2018 в 14:37 ," Компания Mionix в свое время удивила нас мышью Naos QG со встроенным оптическим пульсометром. Нельзя сказать, что такая функциональность необходима в мыши, но идея была интересной. Производитель…", Обновлено: 08.08.2018 в 14:37 , Обзор механической клавиатуры Mionix Wei
191,Владимир Скрипин,   277  , 08.08.2018 в 13:41 , Депутаты киевского городского совета предложили до конца 2019 установить на всех станциях Киевского метрополитена табло обратного отсчета времени до прибытия поезда. Авторами инициативы…, Обновлено: 08.08.2018 в 13:42 ," Депутаты предложили установить в киевском метро систему обратного отсчета времени до прибытия поезда, цена проекта – до 140 млн грн"
192,Владимир Скрипин,   44  , 08.08.2018 в 13:11 ," ОС Android 9.0 Pie уже доступна для смартфонов Google Pixel и Pixel 2, а также сторонних Essential Phone, Nokia 7 Plus и Xiaomi Mix 2s. И некоторые производители уже начали готовить соответствующее обновление до Android 9.0 Pie для…", Обновлено: 08.08.2018 в 13:52 , В следующем году еще дюжина мобильных устройств Samsung получит обновление до Android 8.0 Oreo
193,Вадим Карпусь,   55  , 08.08.2018 в 12:49 ," Компания Intel выпустила новую линейку твердотельных накопителей 660p Series в исполнении M.2 NVMe. В накопителях этой линейки применяются 64-слойные чипы флэш-памяти 3D QLC NAND, способные хранить по 4 бита…", Обновлено: 08.08.2018 в 12:44 , Intel анонсировала SSD 660p Series M.2 NVMe на базе чипов QLC NAND с высокими скоростными показателями и ценой от $100
194,Вадим Карпусь,   12  , 08.08.2018 в 12:22 ," Компания HMD Global начала рассылать приглашения на специальное мероприятие, которое будет проходить в Индии 21 августа. В приглашении не указано, какое именно устройство планируется…", Обновлено: 08.08.2018 в 12:22 , Анонс смартфона Nokia 6.1 Plus ожидается 21 августа
195,Игорь Сушон,   111  , 08.08.2018 в 12:12 ," Сейчас рынок пришел к той точке, в которой не только флагманские, но и доступные устройства могут хорошо работать и приятно выглядеть. Это безусловно не означает, что топовые линейки больше…", Обновлено: 08.08.2018 в 15:55 , Обзор смартфона ASUS ZenFone Max Pro (M1)
196,Владимир Скрипин,   382  , 08.08.2018 в 11:43 ," Позавчера весьма неожиданно Google взяла и выпустила финальную версию новой ОС Android 9.0 Pie. Сейчас новая ОС доступна только владельцам смартфонов Google Pixel и Pixel 2, а также Essential Phone, но до конца осени…", Обновлено: 08.08.2018 в 13:51 , «Пути назад – нет»: В Android 9.0 Pie компания Google лишила пользователей возможности возвращаться на более старые версии ОС
197,Вадим Карпусь,   5  , 08.08.2018 в 11:29 ," Компания NEC анонсировала внедрение крупномасштабной системы распознавания лиц, которая будет запущена к Олимпийским и Паралимпийским играм 2020 года в Токио. Система будет использоваться для…", Обновлено: 08.08.2018 в 10:48 ," NEC показала систему распознавания лиц, которая будет обслуживать Олимпийские игры в Токио в 2020 году"
198,Вадим Карпусь,   18  , 08.08.2018 в 10:59 ," Компания Samsung подготовила к выпуску новый твердотельный накопитель для массового потребительского сегмента рынка, который отличается высокой ёмкостью. Этого удалось достичь благодаря…", Обновлено: 08.08.2018 в 11:37 , Samsung анонсировала SSD ёмкостью 4 ТБ для массового потребительского рынка
199,Владимир Скрипин,   289  , 08.08.2018 в 10:43 ," Не секрет, что интернет в Украине – один из самых дешевых в мире. Очередное тому подтверждение, или, корректнее будет сказать, напоминание – новый рейтинг городов с самым дорогим интернетом,…", Обновлено: 08.08.2018 в 12:06 ," Интернет в Украине по-прежнему один из самых доступных в мире, самый дешевый он – в Сумах [Рейтинг]"
200,Владимир Скрипин,   65  , 08.08.2018 в 10:01 ," Все уже привыкли к постоянным финансовым трудностям и стабильной убыточности тайваньской компании HTC, так что обычно ее ежемесячные отчеты не вызывают абсолютно никакого интереса. Но на…", Обновлено: 08.08.2018 в 09:48 , HTC установила новый антирекорд по выручке за последние 15 лет
201,Игорь Мозуль,   15  , 08.08.2018 в 09:38 ," Компания Mozilla запускает экспериментальное расширение для браузера Firefox под названием Advance, которое рекомендует пользователям новые веб-страницы в зависимости от их предпочтений, а также…", Обновлено: 08.08.2018 в 09:07 ," Новый эксперимент Mozilla: расширение Firefox Advance, которое анализирует историю сетевой активности для подбора потенциально интересных сайтов и статей"
202,Владимир Скрипин,   66  , 08.08.2018 в 09:04 ," Компания «Киевстар» оплатила штраф в 21,3 млн грн, назначенный Антимонопольным комитетом Украины за обман абонентов с посекундной тарификацией. Київстар — посекундна тарифікація Штраф 21 307…", Обновлено: 08.08.2018 в 08:47 ," «Киевстар» заплатил АМКУ штраф в 21,3 млн грн"
203,Игорь Мозуль,   3  , 08.08.2018 в 08:39 ," В преддверие нового учебного года поисковый гигант добавляет несколько новых инструментов в G Suite – набор облачных сервисов, предназначенных для использования учащимися и преподавателями.…", Обновлено: 08.08.2018 в 08:20 , Google существенно обновил образовательную платформу Classroom
204,Владимир Скрипин,   194  , 08.08.2018 в 08:12 ," Вчера вечером основатель и глава известного производителя электромобилей Tesla Илон Маск в очередной раз взбудоражил общественность, а заодно и фондовый рынок — он сообщил, что думает…", Обновлено: 08.08.2018 в 08:22 ," Илон Маск заявил о планах выкупить все акции Tesla. Акции компании резко подорожали более чем на 10%, а биржам пришлось прекратить торги"
205,Вадим Карпусь,   46  , 07.08.2018 в 19:39 ," Шестой и по совместительству финальный сезон сериала «Карточный домик» появится в стриминговом сервисе Netflix 2 ноября. Примечательно, что в качестве даты выхода выбран период накануне…", Обновлено: 07.08.2018 в 20:03 , Заключительный (шестой) сезон сериала «Карточный домик» выйдет в Netflix 2 ноября
206,Владимир Скрипин,   92  , 07.08.2018 в 18:43 ," Как известно, с выпуском версии 8.0 в прошлом месяце новый дизайн в духе мобильной версии настиг и классическое приложение Skype для настольных систем. Одновременно Microsoft объявила о прекращении…", Обновлено: 07.08.2018 в 18:45 , Microsoft оставит классическую настольную версию Skype со старым дизайном еще на какое-то время
207,Вадим Карпусь,   128  , 07.08.2018 в 18:19 ," Компания TP-Link сообщила о старте продаж в Украине роутера Archer C5400X. Отмечается, что это первое игровое решение в модельном ряду компании. Геймерский роутер TP-Link Archer C5400X основан на 4-ядерном…", Обновлено: 08.08.2018 в 08:38 , В Украине начались продажи игрового роутера TP-Link Archer C5400X по цене 9999 грн
208,Вадим Карпусь,   88  , 07.08.2018 в 17:39 ," На странице вопросов-ответов Fallout 76 появилась информация о поддерживаемых платформах для грядущей бета-версии и финальной версии игры. При этом было сказано, что игра будет доступной для «Xbox…", Обновлено: 07.08.2018 в 17:39 , Игра Fallout 76 не выйдет в Steam
209,Владимир Скрипин,   101  , 07.08.2018 в 17:15 , Сегодня космическая компания SpaceX Илона Маска успешно вывела на геостационарную орбиту индонезийский спутник связи. Но сам запуск ракеты-носителя Falcon 9 интересен другим – это впервые…, Обновлено: 07.08.2018 в 17:15 , SpaceX впервые повторно запустила мощнейшую модификацию ракеты Falcon 9 Block 5 (и снова посадила ее)
210,Вадим Карпусь,   133  , 07.08.2018 в 16:07 , Готовящаяся к выпуску версия настольной операционной системы macOS Mojave получит усовершенствованный инструментарий переноса данных при миграции с платформы Windows. При переходе с ПК на Mac…, Обновлено: 07.08.2018 в 18:27 , В macOS Mojave появится улучшенный инструментарий для миграции с Windows на Mac
211,Владимир Скрипин,   76  , 07.08.2018 в 15:29 ," Как стало известно, фильм «Бобот і Енергія Всесвіту», трейлер которого мы смотрели весной, заинтересовал европейских прокатчиков – права на международный прокат украинского фэнтези про…", Обновлено: 07.08.2018 в 15:29 , Датская LevelK купила права на международный прокат украинского фильма про ожившую трансформаторную будку «Бобот і Енергія Всесвіту»
212,Владимир Скрипин,   87  , 07.08.2018 в 14:43 ," С выходом каждой новой версии Android у части пользователей всегда возникает один и тот же вопрос о том, планируется ли выпуск соответствующего обновления для их смартфона, и если да, то когда?…", Обновлено: 07.08.2018 в 14:30 , Смартфоны Nokia одними из первых получат новую ОС Android 9.0 Pie
