,author,counts,date,sometext,time,title
168,Владимир Скрипин,   93  , 27.07.2018 в 13:32 ," В Украине появилось новое бесплатное мобильное приложение Autogram. И это мессенджер, который в первую очередь нацелен на автомобилистов, хотя он также может заинтересовать и остальных. Как и в…", Обновлено: 30.07.2018 в 15:21 , Autogram – украинский мессенджер для автомобилистов и не только
169,Антон Поздняков,   0  , 27.07.2018 в 13:04 ," Где и когда смотреть лунное затмение, что означает обнаружение жидкой воды на Марсе, можно ли заменить политиков с помощью ИИ и очередные запуски ракет. iTunes | Spotify | Скачать Темы [00:00:33] ⋅⋅⋅…", Обновлено: 27.07.2018 в 13:04 ," Подкаст The Big Beard Theory 175: Кровавая Луна, вода на Марсе и замена политиков с помощью ИИ"
170,Сергей Кулеш,   174  , 27.07.2018 в 12:59 ," Серия юмористических роликов Ingenius, в которых Samsung высмеивает недостатки смартфонов iPhone, постепенно превращается в полноценный сериал. Несколько часов назад вышли еще три серии первого…", Обновлено: 27.07.2018 в 20:41 ," Samsung выпустила три новых юмористических ролика Ingenius, в которых троллит iPhone X за «челку», отсутствие сплит-скрина и слота для microSD"
171,Вадим Карпусь,   15  , 27.07.2018 в 12:35 ," По данным сразу нескольких источников, грядущий порт игры Fortnite для Android будет представлен одновременно с презентацией нового смартфона Samsung Galaxy Note9. При этом игра может на 30 дней стать…", Обновлено: 27.07.2018 в 12:35 , Игра Fortnite для Android может стать эксклюзивом для Galaxy Note9 сроком на один месяц
172,Владимир Скрипин,   65  , 27.07.2018 в 11:41 ," Уже на следующей неделе Electronic Arts запустит новый игровой подписочный сервис Origin Access Premier. Служба заработает в грядущий понедельник, 30 июля. Стоимость подписки на этот сервис составит $14,99 за…", Обновлено: 27.07.2018 в 13:24 , EA запустит сервис Origin Access Premier с неограниченным доступом ко всем играм 30 июля
173,Реклама,   15  , 27.07.2018 в 11:10 ," У Києві відбулося відкриття сучасної лабораторії хімічного аналізу Public Lab. Лабораторія надаватиме доступні послуги із проведення всіх видів аналізів, необхідних для контролю якості…", Обновлено: 27.07.2018 в 11:07 , Public Lab перша лабораторія для потреб киян P
174,Сергей Кулеш,   108  , 27.07.2018 в 10:53 ," Сегодня, 27 июля 2018 года, «Киевстар» включил мобильный интернет четвертого поколения по технологии LTE еще в 457 населенных пунктах в восьми областях Украины. Так, услуги 4G стали доступны…", Обновлено: 27.07.2018 в 10:58 , «Киевстар» увеличил территорию покрытия 4G на 457 населенных пунктов в восьми областях Украины
175,Вадим Карпусь,   9  , 27.07.2018 в 10:39 , Недавно представленный смартфон Oppo Find X с инновационной моторизированной секцией с камерами попал в руки известного разрушителя гаджетов JerryRigEverything. Он провёл ряд традиционных тестов и…, Обновлено: 27.07.2018 в 10:13 , Слишком хрупкий: Смартфон Oppo Find X провалил тест на сгибание
176,Олег Касич,   61  , 27.07.2018 в 10:15 ," Потенциальные владельцы топовых процессоров зачастую изначально планируют покупку эффективного охладителя, выделяя необходимые бюджеты. Когда же речь идет о чипах начального или даже…", Обновлено: 27.07.2018 в 10:12 , Обзор процессорных кулеров Aardwolf Performa 3X и Performa 5X
177,Владимир Скрипин,   10  , 27.07.2018 в 10:02 ," Планшет Samsung Galaxy Tab S4 в последнее время все чаще фигурирует в разного рода утечках. Устройству приписывают дисплей диагональю 10,5 дюйма, SoC Snapdragon 835 и аккумулятор емкостью 7300 мА·ч. В сети уже…", Обновлено: 27.07.2018 в 10:02 ," Планшет Samsung Galaxy Tab S4 засветился на видео, его анонс ожидается вместе с Galaxy Note9 в Нью-Йорке"
178,Владимир Скрипин,   14  , 27.07.2018 в 09:29 ," Одновременно со многими другими компаниями, у которых календарный год совпадает с финансовым, отчет за второй квартал 2018 года опубликовала компания Intel, которая недавно лишилась CEO. Отчетный…", Обновлено: 27.07.2018 в 09:12 , Чистая прибыль Intel выросла почти вдвое
179,Игорь Мозуль,   39  , 27.07.2018 в 09:09 ," Virgin Galactic неоднократно заявляла, что в текущем году её космоплан VSS Unity достигнет космоса и, похоже компания всё-таки сумеет реализовать задуманное. В четверг, 26 июля, был успешно осуществлён…", Обновлено: 27.07.2018 в 08:49 , Космоплан VSS Unity совершил третий полет и поднялся на рекордную высоту в 52 км
180,Владимир Скрипин,   68  , 27.07.2018 в 08:32 ," На этой неделе китайский промышленный гигант Xiaomi выпустил свой самый дорогой продукт. И это, как многие уже догадались, не смартфон и даже не телевизор, а… полный набор мебели для дома. Судя…", Обновлено: 27.07.2018 в 08:32 , Xiaomi выпустила свой самый дорогостоящий продукт
181,Игорь Мозуль,   130  , 27.07.2018 в 08:01 ," Команда разработчиков Telegram выпустила новую версию своего мессенджера для мобильных платформ с индексом 4.9, в которой появился Telegram Passport – унифицированный метод авторизации в сервисах,…", Обновлено: 27.07.2018 в 07:26 , «Авторизация по паспорту»: Telegram официально запустил сервис Passport для хранения данных пользователей
182,Сергей Кулеш,   90  , 26.07.2018 в 21:07 ," Один из наиболее известных американских производителей одежды и аксессуаров Tommy Hilfiger выпустит линейку умной одежды Tommy Jeans Xplore, которая поощряет своего владельца почаще надевать ее. В…", Обновлено: 26.07.2018 в 21:13 ," Tommy Hilfiger представил коллекцию умной одежды Xplore, которая поощряет владельцев почаще надевать ее (и искать специальные места встреч бренд-амбассадоров)"
183,Сергей Кулеш,   22  , 26.07.2018 в 20:01 ," По данным осведомленных источников медиакомпании Nikkei, китайская компания Huawei рассчитывает во что бы то ни стало обогнать Samsung и первым выпустить свой гибкий смартфон на рынок. В этом ей…", Обновлено: 26.07.2018 в 20:01 ," Huawei планирует обогнать Samsung в гонке сгибаемых смартфонов, представив свою первую модель в самом начале 2019 года"
184,Вадим Карпусь,   32  , 26.07.2018 в 19:16 , Во время проведения заседания Совета финансовой стабильности была представлена концепция законодательного регулирования операций с криптовалютами в Украине. Её разработкой и…, Обновлено: 26.07.2018 в 18:51 , НКЦБФР представила концепцию законодательного регулирования операций с криптовалютами в Украине
185,Сергей Кулеш,   4  , 26.07.2018 в 18:55 ," Компания Samsung Electronics объявила сегодня о старте массового производства первых в полупроводниковой индустрии модулей оперативной памяти LPDDR4X (Low Power, Double Data Rate, 4X) второго поколения, выполненных…", Обновлено: 26.07.2018 в 18:55 , Samsung начал массовое производство второго поколения 10 нм ОЗУ для смартфонов LPDDR4X с меньшим энергопотреблением и габаритами
186,Владимир Скрипин,   88  , 26.07.2018 в 18:39 ," Samsung начала артподготовку анонса нового флагманского смартфона Galaxy Note9, который намечен на 9 августа. На канале южнокорейского гиганта в YouTube были опубликованы сразу три официальных…", Обновлено: 26.07.2018 в 18:43 , Samsung рекламирует большой аккумулятор и другие особенности смартфона Galaxy Note9
187,Вадим Карпусь,   109  , 26.07.2018 в 18:01 ," Очередная проблема обнаружилась в новых компьютерах компании Apple. Напомним, сразу же после начала продаж новых ноутбуков MacBook Pro с сенсорной панелью Touch Bar выяснилось, что штатная система…", Обновлено: 27.07.2018 в 09:02 , В новых компьютерах Apple MacBook Pro и iMac Pro начала проявляться ошибка «паника ядра» с последующей перезагрузкой системы
188,Сергей Кулеш,   21  , 26.07.2018 в 17:50 ," Только что в магазине контента Google Play вышло продолжение популярного мобильного платформера Alto’s Adventure. Игру Alto’s Odyssey можно загрузить бесплатно по следующей ссылке, но для того, чтобы…", Обновлено: 26.07.2018 в 17:47 ," Android-версия платформера Alto’s Odyssey доступна для загрузки бесплатно, но за отключение рекламы придется заплатить 55 грн"
189,Владимир Скрипин,   8  , 26.07.2018 в 17:38 ," Шведская компания Spotify, который в апреле вышла на биржу, сегодня опубликовала свой второй финансовый отчет. Для владельца одноименного музыкального стриминг-сервиса 30 июня завершился второй…", Обновлено: 26.07.2018 в 17:38 ," Пользовательская база Spotify превысила 180 млн человек, количество платных подписчиков выросло до 83 млн человек"
190,Вадим Карпусь,   27  , 26.07.2018 в 17:24 ," По словам финансового директора Qualcomm Джорджа Дэвиса, в iPhone нового поколения компания Apple не будет использовать модемы производства Qualcomm, а переключится на продукцию конкурента. Он не уточнил…", Обновлено: 26.07.2018 в 17:24 , Qualcomm: Apple перейдёт на использование модемов конкурента (Intel) для iPhone 2018 года
191,Сергей Кулеш,   26  , 26.07.2018 в 16:39 , Президент телесети HBO Кейси Блойс (Casey Bloys) в общении с журналистами раскрыл несколько подробностей о финальном сезоне сериала Game of Thrones / «Игра престолов» и будущем приквеле по данной…, Обновлено: 26.07.2018 в 16:41 ," HBO: Финальный сезон Game Of Thrones выйдет в первой половине 2019 года, а первый и единственный приквел начнут снимать не раньше следующего года"
192,Владимир Скрипин,   158  , 26.07.2018 в 16:11 ," Вне всякий сомнений, главное «достоинство» операционной системы Windows 10 — это способность обновляться, когда ей вздумается. И хотя еще в прошлом году разработчики добавили опцию отсрочки,…", Обновлено: 26.07.2018 в 16:11 ," Microsoft подключила машинное обучение, чтобы отучить Windows 10 перезагружать ПК, когда ей вздумается"
193,Сергей Кулеш,   65  , 26.07.2018 в 15:48 , Очередь на персонализацию загранпаспортов на полиграфкомбинате «Украина» полностью ликвидирована и документы выдаются в установленные законодательством сроки — в течение 7 или 20…, Обновлено: 26.07.2018 в 15:34 ," ГМС: Очередей на персонализацию биометрических загранпаспортов больше нет, все заказанные документы выдаются вовремя по всей Украине"
194,Вадим Карпусь,   12  , 26.07.2018 в 15:23 ," Во время проведения конференции Next компания Google анонсировала новое решение для обеспечения безопасности – Titan Security Key. На текущий момент оно доступно клиентам облачных сервисов Cloud, но на…", Обновлено: 26.07.2018 в 17:01 , Google анонсировала запуск физических ключей Titan Security Key для обеспечения безопасной авторизации
195,Сергей Кулеш,   33  , 26.07.2018 в 14:59 ," Украинский оператор мобильной связи lifecell подвел финансовые и операционные итоги деятельности за второй квартал 2018 года. Операционный доход lifecell за этот период увеличился на 8,8 % за год, до 1…", Обновлено: 26.07.2018 в 15:06 , lifecell объявил результаты деятельности за второй квартал 2018 года
196,Роман Мельниченко,   105  , 26.07.2018 в 14:30 ," Кроссовер Mitsubishi Eclipse Cross открывает новую страницу для марки в Украине: это самый технологичный и современный автомобиль в гамме Mitsubishi, этакий «маячок» для привлечения внимания клиентов в 2018-м…", Обновлено: 26.07.2018 в 14:30 ," Mitsubishi Eclipse Cross: не откровение, но большой шаг вперед"
197,Владимир Скрипин,   108  , 26.07.2018 в 14:17 ," В прошлом году на конференции Google I/O было объявлено, что в Google Drive насчитывается более 800 млн активных пользователей и более 2 трлн файлов. Сейчас же стало известно, что около 1 млрд людей по…", Обновлено: 26.07.2018 в 17:43 , Google Drive – восьмой продукт компании с более миллиардом активных пользователей
198,Сергей Кулеш,   14  , 26.07.2018 в 13:58 , По данным компании Киевстар ее абоненты продолжают активно использовать мобильную связь в роуминге — во втором квартале 2018 года таких пользователей стало на 63% больше в сравнении со…, Обновлено: 26.07.2018 в 13:27 , Киевстар: За последние два года использование мобильного интернета в роуминге выросло более чем в 15 раз
199,Сергей Кулеш,   44  , 26.07.2018 в 13:34 ," Компания Samsung Display заявила, что созданный ее специалистами «неразбиваемый OLED-экран» (Unbreakable Panel) сертифицирован лабораторией Underwriters Laboratories (UL), которая является официальным тестовым…", Обновлено: 26.07.2018 в 14:12 ," Samsung Display продемонстрировал сертифицированный «неразбиваемый» OLED-экран, который выдерживает удар молотком [видео]"
200,Владимир Скрипин,   6  , 26.07.2018 в 13:06 ," Помимо блокчейн-смартфона HTC Exodus в этом году мы, судя по всему, увидим еще одну модель от этого производителя, подробностями о которой поделился источник. Устройство проходит под кодовым…", Обновлено: 26.07.2018 в 14:12 , Опубликованы характеристики смартфона среднего уровня HTC U12 Life
201,Сергей Кулеш,   17  , 26.07.2018 в 12:45 ," До анонса новых смартфонов iPhone с более производительными процессорами Apple A12 остается чуть больше месяца, а производитель только решился прорекламировать свой предыдущий чип A11 Bionic. По…", Обновлено: 26.07.2018 в 12:24 ," Apple сняла рекламу процессора A11 Bionic, в которой герои игры Vainglory проникают в реальную жизнь [видео]"
202,Владимир Скрипин,   64  , 26.07.2018 в 12:18 ," Сегодня утром мы писали, что инвесторов последний квартальный отчет Facebook не впечатлил (рост выручки оказался недостаточно высоким), в результате чего акции крупнейшей соцсети обвалились…", Обновлено: 26.07.2018 в 14:12 , Марк Цукерберг потерял почти $17 млрд из-за недовольства инвесторов Facebook и рискует выбыть из тройки богатейших людей планеты
203,Владимир Скрипин,   15  , 26.07.2018 в 11:38 ," По предыдущим утечкам нам известно, самая младшая из трех новых моделей смартфонов iPhone, которые представят в сентябре этого года, тоже будет иметь вырез в верхней части экрана. Но именно этот…", Обновлено: 26.07.2018 в 11:38 , Самый доступный из новых смартфонов iPhone может задержаться до октября из-за проблем с производством ЖК-экранов с вырезом
204,Вадим Карпусь,   35  , 26.07.2018 в 11:11 , Компания Google выпустила последнюю предварительную тестовую версию операционной системы Android P — Android P Beta 4 (Developer Preview 5). Она включает окончательные функции и возможности операционной…, Обновлено: 26.07.2018 в 11:11 , Google выпустила последнюю предварительную версию Android P накануне официального релиза ОС
205,Владимир Скрипин,   37  , 26.07.2018 в 10:39 ," Facebook вчера отчиталась за второй квартал 2018 финансового года, который для нее, как и для многих других, завершился 30 июня. Забегая наперед, компания нарастила абсолютно все основные финансовые…", Обновлено: 26.07.2018 в 10:39 ," После публикации отличного квартального отчета акции Facebook резко обвалились более чем на 20%, в результате чего соцсеть потеряла $150 млрд"
206,Игорь Мозуль,   158  , 26.07.2018 в 10:03 ," Управление по санитарному надзору за качеством пищевых продуктов и медикаментов (FDA), наконец, признала искусственное мясо компании Impossible Burger безопасным для употребления в пищу. Ранее…", Обновлено: 26.07.2018 в 09:38 , FDA признало безопасными бургеры Impossible Burger с искусственным мясом
207,Реклама,   0  , 26.07.2018 в 10:00 ," 17 августа Академия интернет-маркетинга WebPromoExperts проведет бесплатную конференцию, посвященную контент-маркетингу, — Content Day. Спикеры мероприятия подготовили 15 докладов на основе реальных…", Обновлено: 25.07.2018 в 17:01 , WebPromoExperts приглашает на международную онлайн-конференцию Content Day P
208,Владимир Скрипин,   141  , 26.07.2018 в 09:34 , С 2015 года SpaceX вернула 27 первых ступеней Falcon 9 после запуска (14 из них были успешно использованы повторно) и теперь ее следующей задачей является отработка технологии возврата головного…, Обновлено: 26.07.2018 в 13:16 ," SpaceX увеличила сеть на судне-пауке в четыре раза, но поймать обтекатель ракеты Falcon 9 опять не удалось"
209,Вадим Карпусь,   28  , 26.07.2018 в 09:02 ," Уже завтра, 27 июля, произойдёт полное лунное затмение. Оно будет обладать целым рядом особенностей. Во-первых, это будет второе и последнее лунное затмение 2018 года. Первое затмение в этом году…", Обновлено: 26.07.2018 в 09:21 , 27 июля произойдёт самое длительное полное лунное затмение XXI века с рядом особенностей
