,author,counts,date,sometext,time,title
43,Вадим Карпусь,   29  , 02.08.2018 в 16:03 ," Ещё 2016 году глава компании Tesla Илон Маск заявлял о намерении реализовать в своих электромобилях полноценный автопилот, который позволит совершить полностью автономную поездку из Нью-Йорка в…", Обновлено: 03.08.2018 в 09:06 ," Tesla не спешит внедрять полный автопилот для автономных поездок по всем США, а сосредоточилась на безопасности и разработке собственного чипа ИИ"
44,Владимир Скрипин,   69  , 02.08.2018 в 15:29 ," Украинский стартап LaMetric сообщил о расширении географии продаж умных часов LaMetric Time Японией и родной Украиной. Отметим, что к настоящему времени новинка уже представлена на зарубежных 20…", Обновлено: 02.08.2018 в 15:22 , Украинские умные часы LaMetric Time начали продаваться в Японии и впервые появились в украинской рознице
45,Сергей Кулеш,   66  , 02.08.2018 в 15:01 ," Поначалу новости о выпуске игровых ретро-консолей воспринимались с изрядной долей скептицизма, так как мало кто ожидал, что эти продукты будут продаваться заметным тиражом. Именно поэтому…", Обновлено: 02.08.2018 в 15:31 , В июне ретро-консоль Nintendo NES Classic обогнала по продажам приставки Xbox One и PS4
46,Сергей Кулеш,   88  , 02.08.2018 в 14:52 ," После не самого успешного запуска в 2016 году, компания Nextbike решила перезапустить свой сервис проката велосипедов в Киеве. Тестовый запуск сервиса произойдет 14-15 августа 2018 года, при этом он…", Обновлено: 02.08.2018 в 15:03 ," В Киеве опять запускают сервис проката велосипедов Nextbike, в этот раз без станций и терминалов по цене от 30 грн за 30 мин"
47,Владимир Скрипин,   27  , 02.08.2018 в 14:38 ," Минувший квартал, как известно, стал далеко не самым удачным для южнокорейской компании Samsung, во многом — из-за ухудшения результатов мобильного подразделения. Тогда как для Apple, которая…", Обновлено: 02.08.2018 в 14:38 ," Несмотря на падение продаж в минувшем квартале, Samsung обошла Apple и по объему прибыли, и по рентабельности"
48,Вадим Карпусь,   67  , 02.08.2018 в 14:16 ," Трое граждан Украины были арестованы в связи с расследованием масштабной хакерской операции, жертвами которой стали более 100 американских компаний, включая кражу информации о кредитных…", Обновлено: 02.08.2018 в 16:46 , Группа украинских хакеров арестована в Европе по обвинению в краже данных 15 млн банковских карт в США
49,Сергей Кулеш,   6  , 02.08.2018 в 14:03 ," Украинский оператор мобильной связи Vodafone Украина сообщил, что с момента запуска новой линейки роуминговых тарифов Vodafone в конце 2015 года наблюдает постоянный рост числа роумеров и…", Обновлено: 02.08.2018 в 14:11 ," За последние 2,5 года абоненты Vodafone Украина увеличили потребление мобильного интернета в роуминге в 21 раз"
50,Вадим Карпусь,   16  , 02.08.2018 в 13:52 ," Как ожидается, в скором времени компания Xiaomi выпустит новый ноутбук. Изначально предполагалось, что это будет игровая модель, однако новые данные свидетельствуют, что скорее всего новинка…", Обновлено: 02.08.2018 в 15:02 ," Тизеры-ребусы Xiaomi намекают на презентацию ноутбука Mi Notebook Pro 2 с видеокартой NVIDIA GTX 1050, запланированную на 3 августа"
51,Владимир Скрипин,   97  , 02.08.2018 в 13:26 ," Государственная служба Украины по чрезвычайным ситуациям сообщила о том, что до завтрашнего дня, 3 августа, в некоторых районах Киева будет сохраняться высокий уровень загрязнения воздуха.…", Обновлено: 02.08.2018 в 13:26 , ГСЧС: В некоторых районах Киева уровень загрязнения воздуха в пять-семь раз превышает норму
52,Владимир Скрипин,   82  , 02.08.2018 в 13:06 ," Представленный вчера флагманский планшет Samsung Galaxy Tab S4, который получился достаточно интересным во многих отношениях устройством, уже можно купить, а точнее, предзаказать в Украине.…", Обновлено: 02.08.2018 в 14:46 , Украинские магазины открыли предзаказы на флагманский планшет Samsung Galaxy Tab S4. Версию с LTE на 64 ГБ оценили в 27 999 грн
53,Сергей Кулеш,   39  , 02.08.2018 в 12:29 ," Компания TP-Link выводит на украинский рынок новую линейку из трех смартфонов с дисплеями FullView 18:9. Флагманская модель TP-Link Neffos X9 оснащена двойной камерой 13 МР + 5 МП, в то время как TP-Link Neffos C9A и TP-Link…", Обновлено: 02.08.2018 в 12:29 ," TP-Link вывел на украинский рынок три смартфона с дисплеями FullView 18:9 — Neffos X9, Neffos C9 и Neffos C9A по цене от 2999 грн до 4999 грн"
54,Вадим Карпусь,   3  , 02.08.2018 в 12:01 , Летом прошлого года компания Red анонсировала выпуск достаточно оригинального смартфона под названием Hydrogen One. Его особенностями стали модульная конструкция и голографический дисплей.…, Обновлено: 02.08.2018 в 13:32 ," Смартфон RED Hydrogen One с голографическим дисплеем прошёл сертификацию в FCC, но его презентация снова перенесена"
55,Владимир Скрипин,   87  , 02.08.2018 в 11:40 ," Как известно, итогом минувшего квартала для Tesla стал огромный убыток в размере $742,7 млн, но в целом квартал можно считать удачным, приняв во внимания все, чего компании удалось достичь в этом…", Обновлено: 02.08.2018 в 11:49 , Илон Маск: Tesla будет выпускать до 1 млн автомобилей к 2020 году
56,Владимир Скрипин,   117  , 02.08.2018 в 10:48 ," Ровно два года назад электронная система публичных закупок ProZorro стала обязательной для использования по всей Украине. За это время с помощью ProZorro провели более 2 млн тендеров, на который…", Обновлено: 02.08.2018 в 10:48 , За два года работы ProZorro сэкономила государству более 50 млрд грн
57,Игорь Мозуль,   33  , 02.08.2018 в 10:18 ," Компания Google обновила свою клавиатуру для Android. Последняя версия приложения Gboard с индексом 7.14.19.206421213 получила пару новых функций и поддержку 28 новых языков. Согласно списку изменений,…", Обновлено: 02.08.2018 в 09:56 , Клавиатура Gboard для Android получила функцию добавления надписей к GIF-анимациям
58,Владимир Скрипин,   81  , 02.08.2018 в 09:52 ," В прошлом месяце мы узнали, что Viacom спустя 14 лет решила вернуть на экраны один из самых популярных детских мультсериалов из 90-х – Rugrats / «Невгамовні», который в свое время транслировался на…", Обновлено: 02.08.2018 в 09:52 , The Hollywood Reporter: Warner Bros. готовит продолжение культового сериала «Альф» / A.L.F.
59,Владимир Скрипин,   80  , 02.08.2018 в 09:06 ," Прошлым вечером Tesla опубликовала отчет за второй квартал 2018 финансового года, который у нее завершился 30 июня. Консолидированная выручка выросла с $2,8 млрд до $4 млрд. И это новый рекорд. Если…", Обновлено: 02.08.2018 в 11:28 , Квартальный доход Tesla впервые превысил $4 млрд. Компания наконец начала зарабатывать на седане Model 3
60,Вадим Карпусь,   13  , 02.08.2018 в 08:31 ," Компания Dell сообщила о выпуске обновлённых моделей рабочих станций серии Precision, которые созданы для пользователей, не располагающих крупным бюджетом, но нуждающимися в производительных и…", Обновлено: 02.08.2018 в 09:15 ," Dell обновила линейку рабочих станций Precision, выпустив компактные решения начального уровня"
61,Игорь Мозуль,   15  , 02.08.2018 в 08:02 ," Вирус-вымогатель SamSam, который в начале этого года атаковал крупные организации в нескольких американских штатах, включая и правительственные компьютерные системы, принёс своим создателям…", Обновлено: 02.08.2018 в 07:35 ," Злоумышленник, создавший вирус-вымогатель SamSam, заработал на нем почти $6 млн"
62,Вадим Карпусь,   34  , 01.08.2018 в 21:59 ," Компания GPD HK, воодушевлённая успехом своего прошлогоднего 7-дюймового нетбука GPD Pocket, решила выпустить модель второго поколения и вышла с проектом на краудфандинговую платформу Indiegogo. При…", Обновлено: 01.08.2018 в 21:38 , На выпуск 7-дюймового нетбука GPD Pocket 2 на Indiegogo собрали $1 млн всего за сутки
63,Вадим Карпусь,   6  , 01.08.2018 в 21:35 ," Как ожидается, до конца текущего года компания Huawei выведет на рынок сразу несколько смартфонов серии Mate 20: Mate 20, Mate 20 Pro и Mate 20 Lite. Проанализировав прошивку, получить доступ к которой удалось…", Обновлено: 01.08.2018 в 21:35 ," Новая утечка раскрыла характеристики смартфонов Huawei Mate 20, Mate 20 Pro и Mate 20 Lite"
64,Сергей Кулеш,   76  , 01.08.2018 в 20:53 ," Вместе с премиальным планшетом Galaxy Tab S4 компания Samsung представила и более доступную модель Galaxy Tab A 10,5″, выполненную в том же формате. Производитель позиционирует этот планшет как семейное…", Обновлено: 02.08.2018 в 09:34 ," Samsung Galaxy Tab A 10,5″ — бюджетный планшет для всей семьи на Snapdragon 450, с ОЗУ 3 ГБ, батареей 7300 мАч и четырьмя динамиками Dolby Atmos"
65,Сергей Кулеш,   66  , 01.08.2018 в 19:18 ," Несмотря на слухи о том, что новый планшет Samsung Galaxy Tab S4 представят 9 августа вместе со смартфоном Galaxy Note9, новинку анонсировали сегодня, 1 августа 2018 года. Модель представляет собой продолжение…", Обновлено: 02.08.2018 в 09:19 ," Представлен премиум-планшет Samsung Galaxy Tab S4 с 10,5-дюймовым Super AMOLED-дисплеем, Snapdragon 835, батареей на 7300 мАч и поддержкой S Pen и Samsung DeX"
66,Владимир Скрипин,   236  , 01.08.2018 в 18:24 , Кадр из фантастического боевика Total Recall / Вспомнить всё (1990 года)  Пола Верховена с участием Арнольда Шварценеггера. В нем главный герой с помощью секретного генератора атмосферы…, Обновлено: 04.08.2018 в 09:40 ," Нет, Илон, серьезно. Нельзя просто сбросить термоядерные бомбы на Марс"
67,Сергей Кулеш,   127  , 01.08.2018 в 17:39 ," Киностудия Paramount Pictures опубликовала первую официальную фотографию нового фильма Terminator / «Терминатор» и огласила новую дату премьеры. Год назад создатели надеялись, что картина выйдет в…", Обновлено: 01.08.2018 в 18:01 , Paramount Pictures опубликовала первое фото из нового «Терминатора» и перенесла премьеру на 22 ноября 2019 года
68,Владимир Скрипин,   20  , 01.08.2018 в 17:24 ," Иллюстрация: Alex Castro / The Verge Как известно, в Китае запрещены все сервисы Google (собственно сам поиск Google, почта Gmail, карты Google Maps, магазин Google Play и т.д.), но ситуация вскоре может измениться. Напомним,…", Обновлено: 01.08.2018 в 17:50 , Google Dragonfly — проект по разработке специальной версии поисковика для Китая со встроенной цензурой
69,Вадим Карпусь,   43  , 01.08.2018 в 17:04 , Корпорация Microsoft приступила к тестированию приложения Your Phone для операционной системы Windows 10. Впервые о нём было рассказано во время проведения конференции Build 2018 в начале мая. Приложение Your…, Обновлено: 01.08.2018 в 16:56 ," Microsoft приступила к тестированию приложения Your Phone для Windows 10, но пока что поддерживаются лишь Android-смартфоны"
70,Роман Мельниченко,   208  , 01.08.2018 в 16:47 ," Весной мы детально рассказывали о Nissan LEAF 2: первые впечатления, конструкция и техника. Первый шок прошел и теперь пора говорить с точки зрения реального покупателя: что можно получить, выбирая…", Обновлено: 01.08.2018 в 20:58 , Гид покупателя Nissan LEAF 2: сравниваем разные версии и цены
71,Владимир Скрипин,   9  , 01.08.2018 в 16:38 ," Electronic Arts, которая недавно отказалась от бесплатной раздачи игр и дополнений в Origin, продолжает одаривать поклонников серии игр Battlefield. Месяц назад была раздача дополнений Battlefield 1 Turning Tides и…", Обновлено: 01.08.2018 в 18:35 ," EA бесплатно раздает дополнение Battlefield 1 Apocalypse, а также DLC Battlefield 4 China Rising и Naval Strike"
72,Сергей Кулеш,   212  , 01.08.2018 в 16:08 ," Железнодорожный экспресс, который должен связать ЖД-вокзал «Киев-Пассажирский» с крупнейшим аэропортом страны — Международным аэропортом «Борисполь», строится с опережением графика, а…", Обновлено: 01.08.2018 в 17:46 ," Железнодорожный экспресс в аэропорт «Борисполь» строится с опережением графика, экономия средств по работам уже составляет 120 млн грн"
73,Владимир Скрипин,   45  , 01.08.2018 в 15:53 ," Еще в конце 2016 года Huawei заявила о намерении в течение двух лет обойти Apple на рынке смартфонов, а к 2021 году подвинуть и нынешнего лидера рынка Samsung. На тот момент многие восприняли это громкое…", Обновлено: 01.08.2018 в 15:36 , Huawei впервые обошла Apple по объему отгруженных за квартал смартфонов
74,Сергей Кулеш,   7  , 01.08.2018 в 15:26 ," Сегодня фитнес-сервис Strava запустил новый тип подписки Summit, который призван заменить старый вариант Strava Premium. В отличие от премиального аккаунта, который включал абсолютно все дополнительные…", Обновлено: 01.08.2018 в 16:16 ," Фитнес-сервис Strava запустил новый тип подписки Summit, в котором пользователи могут раздельно купить пакеты Training, Safety и Analysis"
75,Сергей Кулеш,   57  , 01.08.2018 в 15:09 , Немецкий автопроизводитель BMW построит в Европе новую фабрику для сборки электрических и классических автомобилей. Рассчитанное на выпуск 150 тысяч автомобилей в год производство нового…, Обновлено: 01.08.2018 в 14:44 ," BMW построит новую фабрику для производства электромобилей в Венгрии, инвестиции составят 1 млрд евро"
76,Максим Андрейчук,   0  , 01.08.2018 в 15:00 ," Что можно сказать про Doogee X50? Для начала, он работает и это уже неплохо, при этом скорость работы в целом можно назвать приемлемой. На свои 1700 гривен у него неплохой дизайн, вполне симпатичный…", Обновлено: 01.08.2018 в 14:50 , Видеообзор Doogee X50 на Android Go
77,Сергей Кулеш,   84  , 01.08.2018 в 14:53 ," Сегодня, 1 августа 2018 года, Киевстар подключил к скоростному мобильному интернету по технологии LTE еще 448 населенных пункта на Западе и Юге Украины. Так, услуги 4G стали доступны абонентам в…", Обновлено: 01.08.2018 в 14:53 ," «Киевстар» запустил 4G в диапазоне 1800 МГц в Луцке, Черновцах, Могилев-Подольском и еще 448 населенных пунктах Украины"
78,Вадим Карпусь,   34  , 01.08.2018 в 14:42 ," В грядущей версии мобильной операционной системы Android P наконец появится официальная поддержка дисплеев с вырезом. Вместе с тем, компания Google намерена внедрить и некоторые ограничения,…", Обновлено: 01.08.2018 в 16:08 , «Не больше двух»: Google введет в Android ограничения для смартфонов с вырезами в экране
79,Владимир Скрипин,   21  , 01.08.2018 в 13:50 ," Вчера множество новостных ресурсов заявили о том, что с сегодняшнего дня тарифы у оператора мобильной связи Vodafone Украина подорожают в два раза. На самом деле эта информация не соответствует…", Обновлено: 01.08.2018 в 13:50 ," Нет, Vodafone Украина не повышает тарифы в два раза с 1 августа"
80,Владимир Скрипин,   336  , 01.08.2018 в 13:07 ," Мы часто пишем о солидных суммах денежных вознаграждений, которые предлагают (и выплачивают) международные технологические компании вроде Google и Microsoft за уязвимости, выявленные в их…", Обновлено: 01.08.2018 в 13:57 ," «Киевстар» предложил пользователю $50 за найденные пароли к корпоративным системам, тот остался недоволен"
81,Вадим Карпусь,   50  , 01.08.2018 в 12:23 ," Модельный ряд компактных цифровых камер компании Canon пополнился новым устройством PowerShot SX740 HS. Данная модель предназначена для влоггеров и тех пользователей, которые хотят иметь возможность…", Обновлено: 01.08.2018 в 12:35 , Canon выпустила компактную камеру PowerShot SX740 HS с 40-кратным зумом и поддержкой записи видео в разрешении 4K
82,Вадим Карпусь,   15  , 01.08.2018 в 11:36 ," Компания AMD подготовила к выпуску новый набор системной логики B450, предназначенный для создания материнских плат для процессоров и APU в исполнении AM4. Этот чипсет позиционируется в качестве…", Обновлено: 01.08.2018 в 13:51 , AMD анонсировала чипсет B450 для настольной платформы AM4
83,Владимир Скрипин,   149  , 01.08.2018 в 11:00 ," Украинский сервис онлайн-заказа такси Uklon, начавший работу в 2010 году, объявил о своем первом крупном ребрендинге. В рамках ребрендинга компания представила новый логотип и фирменный стиль.…", Обновлено: 01.08.2018 в 16:02 ," Uklon представил новый логотип и фирменный стиль, украинский сервис вызова такси готовится к экспансии"
